"name","orig_id","streetAddress","state","location","platinum"
"BANK NAGARI KC MELAWAI","ADO150621","Jl Melawai Raya No. 19 A","Dki Jakarta","-6.246222,106.799473","N"
"PEGADAIAN UPC PASAR BELIMBING","ADO450130","Jl Belimbing No 12","Dki Jakarta","-6.332656,106.826885","N"
"BRI UNIT JAKARTA TANGKI","AQ6266287","Jl Taman Sari Raya No 1b Rt 012 001","Dki Jakarta","-6.14455,106.82643","N"
"BRI KCP LOKASARI PLAZA","AQ6232770","Lokasari Plaza Blok B No 18","Dki Jakarta","-6.14861,106.82391","N"
"BRI KK GANDARIA CITY","AQ6296316","Jl Sultan Iskandar Muda No 8","Dki Jakarta","-6.238044,106.799061","N"
"BRI KK GANDARIA CITY","AQ6294358","Jl Sultan Iskandar Muda No 8","Dki Jakarta","-6.238044,106.799061","N"
"BRI KK BADAN PERTANAHAN NASIONAL","AQ6237225","Jl Sisingamangaraja No 2","Dki Jakarta","-6.238119,106.79904","N"
"PT POS KPC JAKPUS GAJAH MADA PLAZA","ADO045055","Jl Gajah Mada","Dki Jakarta","-6.159102,106.817924","N"
"BRI KK RS PELNI","AQ6236840","Jl Aipda Ks Tubun No 92 94","Dki Jakarta","-6.19282,106.80484","N"
"BRI KK PERTANI","AQ6237643","Jl Pertani No 1 7 Duren Tiga Pancoran","Dki Jakarta","-6.23605,106.79878","N"
"MAYBANK KCP LINDETEVES TRADE CENTE","ADO007271","Jl Hayam Wuruk Raya No 127 Ra 47","Dki Jakarta","-6.156361,106.81913","N"
"MAYBANK KCP MANGGA BESAR","ADO001923","Jl Mangga Besar Viii No 8","Dki Jakarta","-6.148601,106.823463","N"
"BRI TERAS PASAR SERANG","AQ6310968","Jl Raya Cibarusah Cikarang Blok Esa 16","Jawa Barat","-6.33807,107.12127","N"
"BRI TO TVRI","AQ6289529","Gedung Tvri Jl Gerbang Pemuda No 8","Dki Jakarta","-6.213301,106.80042","N"
"PEGADAIAN CP CILANDAK","ADO191914","Jl Cilandak Kko No 40i","Dki Jakarta","-6.310649,106.814233","N"
"JNE HASYIM ASHARI","ADO161643","Jl Kh Hasyim Ashari No 37 Petojo","Dki Jakarta","-6.165642,106.814354","N"
"BANK SYARIAH INDONESIA KCP CILANDAK 1","AQ6383898","Jl Cilandak Kko No 5 C Rt 014 Rw 008","Dki Jakarta","-6.310115,106.813972","N"
"BANK SYARIAH INDONESIA KCP CILANDAK 1","AQ6382325","Jl Cilandak Kko No 5 C Rt 014 Rw 008","Dki Jakarta","-6.310115,106.813972","N"
"PEGADAIAN UPC PONDOK DAMAI","ADO471227","Jl Raya Cileungsi Cileungsi Kidul Kel","Jawa Barat","-6.4142,106.9709","N"
"PEGADAIAN UPS ANDARA","ADO508431","Jl Margasatwa No 15","Dki Jakarta","-6.310586,106.814151","N"
"MAYBANK KCP SENTRAL SENAYAN 3","ADO601930","Jl Asia Afrika No 8","Dki Jakarta","-6.224125,106.79909","N"
"MAYBANK KCP SENTRAL SENAYAN II","ADO000131","Sentral Senayan Ii Ground Floo","Dki Jakarta","-6.223669,106.799096","N"
"BANK SYARIAH INDONESIA KC CIKARANG","ADO510838","Ruko Cikarang Central City Blok G No 1 2","Jawa Barat","-6.340736,107.119604","N"
"PEGADAIAN UPC KEBON JERUK","ADO429637","Jl Kebun Jeruk Xv No 22","Dki Jakarta","-6.153587,106.820291","N"
"BANK SYARIAH INDONESIA KK AL AZHAR","ADO510520","Komp Masjid Agung Al Azhar","Dki Jakarta","-6.23673,106.79842","N"
"PEGADAIAN UPC CIPETE RAYA","ADO450844","Jl Cipete Raya No 3","Dki Jakarta","-6.277827,106.802854","N"
"BANK SYARIAH INDONESIA KCP CILANDAK 2","ADO510542","Komp Ruko Haji Madali","Dki Jakarta","-6.31082,106.81402","N"
"BANK BJB KCP FATMAWATI 2","ADO205413","Komp Dutamas Itc Fatmawati Ruko A1 No.2","Dki Jakarta","-6.264065,106.80014","N"
"BRI KK BLOK M SQUARE","AQ6237544","Blok M Square Ground Floor","Dki Jakarta","-6.24549,106.79835","N"
"MAYBANK KCP KETAPANG","ADO001945","Jl Kh Zainul Arifin Blok Bii No 16","Dki Jakarta","-6.159907,106.816655","N"
"BRI UNIT JAGAKARSA PASAR MINGGU","AQ6268586","Jl Waru Sila No 1","Dki Jakarta","-6.33902,106.82987","N"
"BRI UNIT KEBAGUSAN JAKARTA","AQ6268597","Jl Raya Jagakarsa No 32 Rt 02 Rw 07","Dki Jakarta","-6.33902,106.82987","N"
"PEGADAIAN UPC PETOJO","ADO450394","Jl Hanura Raya No 23","Dki Jakarta","-6.169799,106.811977","N"
"BANK BJB KCP KS TUBUN","ADO204719","Jl Ks Tubun No 2b Kel Petamburan Kec Tnh","Dki Jakarta","-6.189045,106.805043","N"
"PT POS KPC JAKPUS DPR","ADO170113","Ged Dpr Mpr Jl Gatot Subroto","Dki Jakarta","-6.208383,106.800504","N"
"BRI KK KEJAKSAAN AGUNG","AQ6237654","Komplek Ged Kejaksaan Agung","Dki Jakarta","-6.24148,106.79792","N"
"BRI KCP PLN JAKARTA","AQ6233814","Jl Trunojoyo 35 Blok M","Dki Jakarta","-6.23959,106.79786","N"
"BRI UNIT LENTENG AGUNG PSR MINGGU","AQ6268409","Jl Moch Kafi Ii No 10 Srengseng Sawah","Dki Jakarta","-6.33569,106.82724","N"
"BRI UNIT LENTENG AGUNG","AQ6292840","Jl Moch Kafi Ii No 10 Srengseng Sawah","Dki Jakarta","-6.33569,106.82724","N"
"PT POS KPC JAKBAR SLIPI","ADO078956","Jl Ks Tubun Iv No 34","Dki Jakarta","-6.197064,106.802646","N"
"BRI KCP HARCO MANGGA DUA","AQ6232923","Harco Mangga Dua Komp Agung Sedayu","Dki Jakarta","-6.13834,106.8287","N"
"BANK BJB KCP CIPONDOH","ADO203224","Jl K H Hasyim Ashari Kec Cipondoh","Banten","-6.1655,106.8132","N"
"PEGADAIAN CP CISALAK","ADO471359","Jl Raya Bogor Km 31 No 4","Jawa Barat","-6.377545,106.865505","N"
"PT POS LE GELORA","ADO174283","Kantor Kelurahan Gelora Senayan","Dki Jakarta","-6.213659,106.799071","N"
"BANK BJB KC GAJAH MADA","ADO201705","Jl Gajah Mada No 86a 86b Rt 12 Rw 01","Dki Jakarta","-6.155765,106.817849","N"
"BANK SYARIAH INDONESIA KCP P POLIM 2","AQ6383832","Jl Panglima Polim Raya No 71","Dki Jakarta","-6.250502,106.797633","N"
"BANK SYARIAH INDONESIA KCP P POLIM 2","AQ6382260","Jl Panglima Polim Raya No 71","Dki Jakarta","-6.250502,106.797633","N"
"PEGADAIAN UPC BLOK M","ADO451119","Jl Panglima Polim Raya No 3c","Dki Jakarta","-6.255113,106.798001","N"
"MAYBANK KCP HARCO MANGGA DUA","ADO002627","Ruko Agung Sedayu Blok G No. 2, Jl.","Dki Jakarta","-6.136831,106.829254","N"
"MAYBANK KCP PANGLIMA POLIM","ADO000296","Jl Panglima Polim Raya 79","Dki Jakarta","-6.251248,106.797605","N"
"BRI KK VIRAMA KARYA","AQ6237555","Jl Hang Tuah Raya No 26 Kebayoran Baru","Dki Jakarta","-6.22936,106.79735","N"
"BRI KK KEMENTERIAN PEMUDA N OLAHRAGA","AQ6238293","Lingk Kemenegpora Jl Gerbang Pemuda No 3","Dki Jakarta","-6.2127,106.79889","N"
"BRI KK KEMENTERIAN PEMUDA N OLAHRAGA","AQ6294523","Lingk Kemenegpora Jl Gerbang Pemuda No 3","Dki Jakarta","-6.2127,106.79889","N"
"BRI KK KEMENTERIAN PEMUDA N OLAHRAGA","AQ6296482","Lingk Kemenegpora Jl Gerbang Pemuda No 3","Dki Jakarta","-6.2127,106.79889","N"
"BANK SYARIAH INDONESIA KCP HARCO MANGGA2","AQ6381148","Komplek Harco Agung Sedayu Blok D No 5","Dki Jakarta","-6.136556,106.829232","N"
"BANK SYARIAH INDONESIA KC BSD PSR MODERN","ADO513424","Ruko Pasar Modern Timur Bsd Blk A 19 21","Banten","-6.153654,106.81859","N"
"BRI KK MPR DPR","AQ6294480","Gedung Mpr Dpr Nusantara V","Dki Jakarta","-6.20903,106.79942","N"
"BRI KK MPR DPR","AQ6296448","Gedung Mpr Dpr Nusantara V","Dki Jakarta","-6.20903,106.79942","N"
"BRI KK MPR DPR","AQ6238194","Gedung Mpr Dpr Nusantara V","Dki Jakarta","-6.20903,106.79942","N"
"PT POS KPC JAKPUS JATI PETAMBURAN","ADO078736","Jl Jati Petamburan Iv No 44 Rt 8 Rw 5","Dki Jakarta","-6.201518,106.800847","N"
"BANK SYARIAH INDONESIA KCP CIMANGGIS 1","ADO511763","Jl Raya Bogor Km 31 Pasar Cisalak","Jawa Barat","-6.37843,106.86589","N"
"BANK SYARIAH INDONESIA KK GD PUSAT","AQ6381896","Kantor Cab Bank Mandiri Wisma Manggala","Dki Jakarta","-6.206384,106.799847","N"
"BRI KCP CIKARANG SELATAN","AQ6233320","Jl Raya Cikarang Cibarusah No 39b","Jawa Barat","-6.31852,107.13494","N"
"BRI KC JAKARTA PANGLIMA POLIM","AQ6230789","Ruko Grand Panglima Polim Kav 20 21","Dki Jakarta","-6.25293,106.79745","N"
"BRI KCP KEMENTERIAN KEHUTANAN JAKARTA","AQ6233771","Gedung Manggala Wanabakti","Dki Jakarta","-6.20664,106.79967","N"
"BPD JATENG KC JAKARTA","ADO520024","Ruko Grand Panglima Polim Kav 25 28","Dki Jakarta","-6.25373,106.797474","N"
"PT POS KPC JAKPUS MANGGALA WANABAKTI","ADO170124","Ged Manggala Wjl Gatot Subroto","Dki Jakarta","-6.206706,106.799581","N"
"PEGADAIAN UPC ITC FATMAWATI","ADO429484","Jl Rs Fatmawati Lt 1 No 41","Dki Jakarta","-6.264151,106.798594","N"
"BANK SYARIAH INDONESIA KCP P POLIM 1","ADO512719","Komp Ruko Grand Panglima Polim No 32 33","Dki Jakarta","-6.25476,106.79743","N"
"PT POS KPC JAKBAR KOTABAMBU","ADO078967","Jl Kota Bambu Utara Rt 05 04 Palmerah","Dki Jakarta","-6.186002,106.80456","N"
"BRI TERAS PASAR CIPETE","AQ6311211","Jl Damai Raya No 7 Rt 12 Rw 01","Dki Jakarta","-6.26005,106.79796","N"
"BANK SUMSEL KC JAKARTA","ADO270455","Jl Panglima Polim Raya No 5 6","Dki Jakarta","-6.254479,106.797348","N"
"PEGADAIAN UPC PASAR PANGLIMA POLIM","ADO476596","Jl Panglima Polim Raya No 19e","Dki Jakarta","-6.252571,106.79714","N"
"BRI UNIT BLOK A RADIO DALAM","AQ6268629","Jl Panglima Polim 127 A Keb Baru","Dki Jakarta","-6.25542,106.797298","N"
"BRI KCP MELAWAI","AQ6233803","Jl Melawai Raya No 72","Dki Jakarta","-6.24568,106.79659","N"
"PEGADAIAN UPC KOTABAMBU","ADO424962","Jl Kota Bambu Utara Iv Utara No 4","Dki Jakarta","-6.182194,106.805456","N"
"PT POS KPC JAKBAR JATIPULO","ADO078978","Jl Semangka Ii No 1 Palmerah","Dki Jakarta","-6.179859,106.806217","N"
"PEGADAIAN UPC JAGAKARSA","ADO476705","Jl Jagakarsa Raya No 109 Rt 00 Rw 00","Dki Jakarta","-6.326688,106.81975","N"
"BRI KCP PANGERAN JAYAKARTA","AQ6232846","Jl P Jayakarta No 26 Blok A I","Dki Jakarta","-6.14103,106.82513","N"
"BRI UNIT PANGERAN JAYAKARTA","AQ6266342","Jl P Jayakarta No 72 74 Blok B2","Dki Jakarta","-6.14101,106.82511","N"
"BRI TERAS PASAR PETOJO","AQ6310430","Jl Am Sangaji","Dki Jakarta","-6.16283,106.81282","N"
"PT POS KPC JAKPUS MANGGADUA","ADO045307","Jl Mangga Dua Dalam No 14 Sawah Besar","Dki Jakarta","-6.13877,106.826344","N"
"BRI KK AKSES UI","AQ6294347","Jl Akses Ui No 45 Rt 02 Rw 09 Kel Tugu","Jawa Barat","-6.35445,106.83895","N"
"BRI KK AKSES UI","AQ6296305","Jl Akses Ui No 45 Rt 02 Rw 09 Kel Tugu","Jawa Barat","-6.35445,106.83895","N"
"BRI KCP TOMANG","AQ6234464","Jl Kyai Caringin No 68","Dki Jakarta","-6.17155,106.8087","N"
"BRI KCP TOMANG","AQ6293906","Jl Kyai Caringin No 68","Dki Jakarta","-6.17155,106.8087","N"
"BRI KCP TOMANG","AQ6295865","Jl Kyai Caringin No 68","Dki Jakarta","-6.17155,106.8087","N"
"MNC BANK KCP FATMAWATI","ADO210219","Komplek Duta Mas Blok A1 No 3","Dki Jakarta","-6.263576,106.797486","N"
"BANK SYARIAH INDONESIA KC HARCO MANGGA","ADO511499","Komp Ruko Harco Blok C No 11","Dki Jakarta","-6.136242,106.82771","N"
"BRI KK PASAR CIPETE","AQ6296338","Jl Raya Cipete Fatmawati","Dki Jakarta","-6.26052,106.79678","N"
"BRI KK PASAR CIPETE","AQ6294370","Jl Raya Cipete Fatmawati","Dki Jakarta","-6.26052,106.79678","N"
"BRI KC JAKARTA HAYAM WURUK","AQ6230327","Jl Hayam Wuruk No 108","Dki Jakarta","-6.15196,106.81768","N"
"BANK SYARIAH INDONESIA KCP PONDOK LABU","ADO512917","Graha Fatmawati Jl Rs Fatmawati Blok A","Dki Jakarta","-6.26513,106.79738","N"
"PEGADAIAN UPC BIAK","ADO429077","Pertokoan Metro Biak Jl Biak No 5j","Dki Jakarta","-6.170353,106.808573","N"
"JNE FATMAWATI","ADO160653","Jl Rs Fatmawati Raya No17 A","Dki Jakarta","-6.260348,106.79638","N"
"PT POS KPC KETAPANG","ADO078659","Desa Ketapang Ketapang","Lampung","-6.168293,106.809264","N"
"PEGADAIAN UPC BOJONG KULUR","ADO471106","Jl Letda Natsir Rt 01 09 Bojong Kulur","Jawa Barat","-6.4153,106.9452","N"
"PEGADAIAN UPC CIKEAS","ADO503447","Kp Cikeas Nagrak No 22 Gunung Putri Kel","Jawa Barat","-6.4153,106.945","N"
"BRI KC CIKARANG","AQ6230581","Ruko Cikarang Comersial Centre","Jawa Barat","-6.30141,107.14479","N"
"PEGADAIAN UPC TEGAL PARANG","ADO477113","Jl Mampang Prapatan Xi No 19c","Dki Jakarta","-6.257166,106.795769","N"
"BANK BJB KC HASYIM ASHARI","ADO202641","Jl Kh Hasyim Ashari No 32 34","Dki Jakarta","-6.16553,106.810224","N"
"BRI KK RS PERTAMINA","AQ6237676","Jl Kyai Maja No 43","Dki Jakarta","-6.23957,106.79473","N"
"MAYBANK KCP GAJAHMADA","ADO000757","Jl. Ir. H. Juanda No. 27a","Dki Jakarta","-6.151571,106.816998","N"
"BANK SYARIAH INDONESIA KC FATMAWATI 1","AQ6382259","Jl Fatmawati No 110 A Rt 01 Rw 04","Dki Jakarta","-6.268491,106.797065","N"
"BANK SYARIAH INDONESIA KC FATMAWATI 1","AQ6383821","Jl Fatmawati No 110 A Rt 01 Rw 04","Dki Jakarta","-6.268491,106.797065","N"
"PT POS KPC JAKBAR KRUKUT","ADO078912","Jl Kejayan Dalam No 33a Taman Sari","Dki Jakarta","-6.15597,106.814525","N"
"BRI UNIT SERTAJAYA TAMBUN","AQ6267167","Jl Industri Tegal Gede Kav No 6","Jawa Barat","-6.30065,107.14552","N"
"PT POS LE JKS MANDIRI PLAZA","ADO900404","Jl Rs Fatmawati No 10","Dki Jakarta","-6.27207,106.797593","N"
"MAYBANK KCP PALMERAH","ADO001912","Jl Palmerah Utara 36 38","Dki Jakarta","-6.202799,106.797705","N"
"MNC BANK KK MANGGA DUA","ADO210297","Ruko Arkade Belanja Mangga Dua No 2","Dki Jakarta","-6.136719,106.825628","N"
"PEGADAIAN UPC MANGGA BESAR","ADO450822","Jl Buni No 40","Dki Jakarta","-6.145133,106.820167","N"
"PEGADAIAN UPC LENTENGAGUNG","ADO429813","Jl Jagakarsa Raya No 56 Rt 00 Rw 00","Dki Jakarta","-6.328924,106.818649","N"
"MAYBANK KC FATMAWATI","ADO001439","Jl R S Fatmawati No 28","Dki Jakarta","-6.27645,106.798167","N"
"BANK SYARIAH INDONESIA KCP FATMAWATI","ADO510717","Jl Rs Fatmawati No 27 B","Dki Jakarta","-6.27713,106.79822","N"
"PT POS KPC JAKSEL GANDARIA UTARA","ADO079243","Jl Haji Nawi Raya No 1","Dki Jakarta","-6.2639,106.795803","N"
"BRI UNIT KEAMANAN","AQ6266298","Jl Keamanan No 54","Dki Jakarta","-6.15135,106.81636","N"
"BRI UNIT KEAMANAN","AQ6292543","Jl Keamanan No 54","Dki Jakarta","-6.15135,106.81636","N"
"PEGADAIAN UPC JABABEKA","ADO425248","Jl Industri Jbbk No 88 Ruko Jababeka","Jawa Barat","-6.294896,107.148171","N"
"BANK SYARIAH INDONESIA KCP S PARMAN","ADO516021","Jl Kemanggisan Raya No B3e Kel Palmerah","Dki Jakarta","-6.196552,106.79871","N"
"BANK BJB KC PURWAKARTA","ADO200672","Jl Jend Sudirman No 63 64","Jawa Barat","-6.371901,106.853095","N"
"BANK MESTIKA KC JAKARTA BIAK","ADO550504","Jl Biak No 58","Dki Jakarta","-6.167004,106.808348","N"
"PEGADAIAN CP BLOK A","ADO191651","Jl Petogogan Ii No 3","Dki Jakarta","-6.250844,106.793969","N"
"PEGADAIAN UPC PALMERAH UTARA","ADO503601","Jl Palmerah Utara Raya No 102","Dki Jakarta","-6.206992,106.796155","N"
"PT POS KPC JAKSEL SRENGSENG SAWAH","ADO079397","Jl M Kahfi Ii Jagakarsa","Dki Jakarta","-6.317541,106.811697","N"
"BRI TERAS PASAR PALMERAH","AQ6311903","Jl Palmerah Raya Lt 2","Dki Jakarta","-6.20816,106.795808","N"
"MNC BANK KK CIKARANG","ADO210187","Jababeka Central Business","Jawa Barat","-6.297,107.148094","N"
"BANK SYARIAH MANDIRI KCP JAKARTA BARITO","ADO673650","Jl Barito No 11a Rt 08 05","Dki Jakarta","-6.24816,106.79346","N"
"BRI UNIT PILAR TAMBUN","AQ6267156","Ruko Pilar Mas Commercial No 4","Jawa Barat","-6.25722,107.15699","N"
"PT POS LE JKS PERTAMINA","ADO174382","Gd Rspp Jl Kyai Maja","Dki Jakarta","-6.240357,106.793153","N"
"PT POS KPC JAKSEL CILANDAK","ADO112320","Jl Maritim No 6 Cilandak","Dki Jakarta","-6.288319,106.800143","N"
"MAYBANK KCP JABABEKA","ADO006313","Jl Niaga Raya Blok 2m Ruko Capitol","Jawa Barat","-6.297305,107.148167","N"
"MAYBANK KCP ITC MANGGA DUA","ADO001703","Itc Mangga Dua Blok D","Dki Jakarta","-6.136192,106.824679","N"
"BANK JATIM KCP MANGGA DUA","ADO264780","Mall Mangga Dua Ruko No 4","Dki Jakarta","-6.136678,106.82431","N"
"BRI KK ITC MANGGA DUA","AQ6237171","Gedung Itc Mangga Dua Lt 1 Blok D No 2 3","Dki Jakarta","-6.13586,106.82479","N"
"PT POS LE MANGGA DUA PASAR PAGI","ADO174700","Jl Arteri Pasar Pagi Mangga Dua","Dki Jakarta","-6.135232,106.824956","N"
"PEGADAIAN UPC PEKAPURAN","ADO471371","Jl Raya Pekapuran No 122","Jawa Barat","-6.386055,106.868819","N"
"PEGADAIAN UPS PONDOK DUTA","ADO506923","Jl Raya Pondok Duta No 75","Jawa Barat","-6.372282,106.851757","N"
"BANK SYARIAH INDONESIA KCP ITC MANGGA2","AQ6381171","Jl Mangga Dua Raya Itc Mangga Dua","Dki Jakarta","-6.135667,106.824394","N"
"BRI TERAS PASAR PECAH KULIT","AQ6299814","Jl Pangeran Jayakarta Pinangsia","Dki Jakarta","-6.140346,106.821065","N"
"BRI KK PENGADILAN NEGRI JAKARTA BARAT","AQ6238204","Jl Letjend S Parman No 71","Dki Jakarta","-6.19326,106.79784","N"
"BRI KK MULTI MEDIA NUSANTARA","AQ6238172","Gedung Gramedia Kompas Jl Gelora Vii","Dki Jakarta","-6.20793,106.79462","N"
"BRI KC JAKARTA MANGGA DUA","AQ6230394","Gd Mall Mangga Dua Kav 23 24","Dki Jakarta","-6.13704,106.82292","N"
"PT POS KPC DEPOK BAKTIJAYA","ADO073951","Jl Pondoc Duta Raya 76 Baktijaya","Jawa Barat","-6.370693,106.849258","N"
"MAYBANK KCP WISMA 77","ADO001583","Wisma 77 Tower 2, Lantai Ground  Zona 1","Dki Jakarta","-6.137271,106.822692","N"
"BANK BJB KK RANCAKALONG","ADO207536","Jl  Raya Rancakalong Sumedang","Jawa Barat","-6.089651,107.082168","N"
"BRI UNIT JEMBATAN LIMA","AQ6292455","Jl Kh Muh Mansyur 22b","Dki Jakarta","-6.17062,106.80494","N"
"BRI UNIT JEMBATAN LIMA","AQ6266056","Jl Kh Muh Mansyur 22b","Dki Jakarta","-6.17062,106.80494","N"
"BANK SYARIAH INDONESIA KCP CIKARANG CBD","AQ6381566","Ruko Cbd Blok Kavling Aa3 Blok Cd No 1","Jawa Barat","-6.299699,107.14864","N"
"BRI TERAS PASAR BENDUNGAN HILIR","AQ6310331","Jl Benhil Raya Pasar Benhil Lantai 2","Dki Jakarta","-6.20844,106.79418","N"
"BRI KCP JABABEKA","AQ6233353","Plaza Roxy Blok S1,no B-7 Jl Kasuari Ry","Jawa Barat","-6.29806,107.14935","N"
"PEGADAIAN UPC KEAGUNGAN","ADO429615","Jl Kp Jawa Kebon Sayur No 1","Dki Jakarta","-6.150599,106.814146","N"
"BRI KCP PASAR PAGI","AQ6232934","Pusat Grosir Pasar Pagi Mangga Dua Lt 2","Dki Jakarta","-6.13599,106.82299","N"
"BANK KALBAR KC JAKARTA","ADO410640","Wisma Eka Jaya Jl Arteri Mangga Dua Rm18","Dki Jakarta","-6.136919,106.822266","N"
"BRI KK POLITEKNIK NEGERI MEDIA KREATIF","AQ6237764","Jl Raya Srengseng Sawah No 4 Jagakarsa","Dki Jakarta","-6.34656,106.82706","N"
"BANK SUMSEL BABEL","ADO270532","Capem Mangga Dua","Dki Jakarta","-6.136093,106.822682","N"
"MAYBANK KC EKAJIWA","ADO000504","Ged Wisma Ekajiwa Lt6 Jl Mangga Dua Raya","Dki Jakarta","-6.137091,106.82199","N"
"PT POS KPC LABANAN","ADO088384","Jl Mojo No 1 Gunung Tabur","Kalimantan Timur","-6.240358,106.791313","N"
"PT POS KPC JAKSEL GUNUNG","ADO072488","Jl Kyai Maja No 41","Dki Jakarta","-6.240352,106.791312","N"
"BANK BJB KCP TOMANG","ADO204083","Jl Tanjung Duren Raya D 84d","Dki Jakarta","-6.189087,106.798049","N"
"BANK BJB KCP MAYESTIK","ADO204753","Jl Kyai Maja No 51a Kebayoran Baru","Dki Jakarta","-6.240477,106.791285","N"
"BRI KK LINDETEVES TC","AQ6236587","Lindeteves Trade Center Lt Gf1 Kj Rb43","Dki Jakarta","-6.14592,106.81624","N"
"PEGADAIAN UPC SUKAMANTRI","ADO470589","Jl Kh Dewantara No 147 Sukamantri","Jawa Barat","-6.244481,107.16","N"
"MAYBANK KCP GLODOK PLAZA","ADO001660","Glodog Plaza Jl Pinangsia Ry B","Dki Jakarta","-6.143177,106.817561","N"
"BANK BJB KK ITC MANGGA DUA","ADO205523","Mall Itc Mangga Dua Lt I D 64","Dki Jakarta","-6.135943,106.822076","N"
"BRI KK PASAR MAYESTIK","AQ6237742","Pasar Mayestik Jl Tebah Raya Unit L2","Dki Jakarta","-6.2415,106.79077","N"
"BANK SYARIAH INDONESIA KK UHAMKA","AQ6382303","Jl Limau 2 No 20 Rt 002 Rw 003","Dki Jakarta","-6.247145,106.79093","N"
"BANK SYARIAH INDONESIA KK UHAMKA","AQ6383876","Jl Limau 2 No 20 Rt 002 Rw 003","Dki Jakarta","-6.247145,106.79093","N"
"BRI UNIT RSAB JAKARTA","AQ6271159","Jl S Parman Kav 87","Dki Jakarta","-6.185,106.79865","N"
"BRI KK RS DHARMAIS","AQ6238215","Jl Letjend S Parman Kav 84 86","Dki Jakarta","-6.18619,106.79821","N"
"MNC BANK KCP ROXY","ADO210132","Jl K H Hasyim Ashari Blok E 1 No 7","Dki Jakarta","-6.168682,106.804318","N"
"BRI KC JAKARTA FATMAWATI","AQ6230734","Jl Rs Fatmawati No 37abc Rt 05 Rw 03","Dki Jakarta","-6.28319,106.79614","N"
"PEGADAIAN CPS METRO BOULEVARD CIKARANG","ADO507090","Jl Niaga Raya Ruko Metro Boulevard A 7","Jawa Barat","-6.300409,107.149754","N"
"PT POS LE JKS MANDIRI PLAZA BAPINDO","ADO900383","Jl Rs Fatmawati No 10","Dki Jakarta","-6.283271,106.796111","N"
"BANK SYARIAH INDONESIA KCP TOMANG","ADO510740","Jl Tomang Raya No 10 Kel Jatipulo","Dki Jakarta","-6.177426,106.80084","N"
"JNE TOMANG 6 WLAGSHIP WU","ADO162918","Jl Tomang Raya No 6","Dki Jakarta","-6.175794,106.801406","N"
"PT POS LE UNTAR","ADO174315","Jl S Parman No 1","Dki Jakarta","-6.190898,106.796626","N"
"PEGADAIAN UPS SRENGSENG SAWAH","ADO506880","Jl Srengseng Sawah No 24","Dki Jakarta","-6.346394,106.82566","N"
"BANK BJB KCP CILANDAK","ADO206546","Jl  Cilandak Kko Ruko H  Madali No 5 6","Dki Jakarta","-6.292053,106.798408","N"
"BANK SYARIAH INDONESIA KCP MAYESTIK","AQ6383865","Jl Kyai Maja Blok D 1 Rt 04 Rw 01","Dki Jakarta","-6.241889,106.790337","N"
"BANK SYARIAH INDONESIA KCP MAYESTIK","AQ6382293","Jl Kyai Maja Blok D 1 Rt 04 Rw 01","Dki Jakarta","-6.241889,106.790337","N"
"JNE TOMANG 45","ADO160686","Jl Tomang Raya No 45","Dki Jakarta","-6.175665,106.801275","N"
"BANK SYARIAH INDONESIA KC FATMAWATI 2","AQ6382248","Jl Rs Fatmawati No 30 C 30 D","Dki Jakarta","-6.283679,106.795808","N"
"BANK SYARIAH INDONESIA KC FATMAWATI 2","AQ6383810","Jl Rs Fatmawati No 30 C 30 D","Dki Jakarta","-6.283679,106.795808","N"
"BRI TERAS PASAR GUNUNG PUTRI","AQ6310858","Jl Raya Cicadas Gunung Putri","Jawa Barat","-6.41834,106.93562","N"
"MAYBANK KCP LINDETEVES","ADO002012","Pasar Hayam Wuruk Lantai 2 Los 9 No 22","Dki Jakarta","-6.144478,106.815847","N"
"BANK BJB KK GLODOK","ADO205545","Ruko Glodok Plaza Blok H 20","Dki Jakarta","-6.142955,106.816663","N"
"BRI KC JAKARTA ROXI","AQ6231229","Pusat Niaga Roxi Mas  Blok B1 No 1 2","Dki Jakarta","-6.16635,106.80462","N"
"BRI KCP SLIPI","AQ6234420","Jl Kemanggisan Raya No 19 6c","Dki Jakarta","-6.18992,106.79627","N"
"BANK BJB KC KEBAYORAN","ADO201189","Jl Melawai Raya No 189","Dki Jakarta","-6.262481,106.791227","N"
"PEGADAIAN UPC PLAZA SLIPI JAYA","ADO477212","Plaza Slipi Jaya Lt Ii No 11c Jl S","Dki Jakarta","-6.189004,106.796291","N"
"MAYBANK KCP RADIO DALAM","ADO600467","Jl Radio Dalam Raya N 1a 1b Rt 001 004","Dki Jakarta","-6.25537,106.790337","N"
"PEGADAIAN UPC SERANG CIKARANG","ADO470545","Jl Raya Serang Baru Kel Serang Cikarang","Jawa Barat","-6.356725,107.11865","N"
"MAYBANK KCP PERMATA HIJAU","ADO002034","Jl Perak Blok B No 17","Dki Jakarta","-6.222185,106.790022","N"
"BRI KCP GLODOK","AQ6232769","Komp Pertokoan Glodok Plaza No B18","Dki Jakarta","-6.1435,106.81545","N"
"BANK BJB KC S PARMAN","ADO204489","Jl S Parman Kav 19 Slipi","Dki Jakarta","-6.19045,106.795526","N"
"MAYBANK KC ROXY MAS","ADO000339","Jl Hasyim Ashari Blok B1 Number 12 A","Dki Jakarta","-6.166326,106.803719","N"
"BANK SYARIAH INDONESIA KC MAYESTIK","ADO510728","Jl Kyai Maja Blok D1 Persil No 6 6a","Dki Jakarta","-6.24232,106.789","N"
"BRI KC JAKARTA S. PARMAN","AQ6231207","Jl Letjend S Parman Blok G9 11","Dki Jakarta","-6.18577,106.79646","N"
"PT POS KPC JAKBAR KEMANGGISAN","ADO072433","Jl Anggrek Rosliana No 27 Palmerah","Dki Jakarta","-6.192667,106.794538","N"
"BRI KK ITC ROXY MAS","AQ6238237","Ruko Roxy Mas Lt 3 Blok I No 78","Dki Jakarta","-6.16663,106.80328","N"
"BRI UNIT SERANG TAMBUN","AQ6267002","Jl Serang","Jawa Barat","-6.35857,107.11787","N"
"PEGADAIAN UPC INSPEKSI ROSLIANA","ADO429451","Jl Inspeksi Anggrek Rosliana Vii No 220a","Dki Jakarta","-6.191113,106.794898","N"
"PEGADAIAN UPC SLIPI JAYA","ADO424984","Jl Anggrek Rosliana Blok D2 No 34","Dki Jakarta","-6.191109,106.794895","N"
"PEGADAIAN UPC P. JAYAKARTA","ADO450987","Jl Raya Pangeran Jayakarta No 34","Dki Jakarta","-6.138753,106.817861","N"
"BANK BJB KK CITEKO PLERED","ADO207790","Jl Raya Warung Kandang Ds Pamoyanan","Jawa Barat","-6.062632,107.036418","N"
"BRI UNIT MAYESTIK RADIO DALAM","AQ6268685","Gandaria Iii 4 Taman Puring","Dki Jakarta","-6.24197,106.78857","N"
"BRI KK RS ZAHIRAH","AQ6296327","Jl Sirsak No 24 Rt 09 Rw 01","Dki Jakarta","-6.3383,106.8178","N"
"BRI KK RS ZAHIRAH","AQ6294369","Jl Sirsak No 24 Rt 09 Rw 01","Dki Jakarta","-6.3383,106.8178","N"
"MAYBANK KCP TOMANG","ADO002177","Jl Tomang Raya 12a","Dki Jakarta","-6.178537,106.798312","N"
"BRI KK MARGASATWA","AQ6294402","Ruko Margasatwa View No C","Dki Jakarta","-6.3111,106.80308","N"
"BRI KK MARGASATWA","AQ6296361","Ruko Margasatwa View No C","Dki Jakarta","-6.3111,106.80308","N"
"BRI KK MARGASATWA","AQ6237753","Ruko Margasatwa View No C","Dki Jakarta","-6.3111,106.80308","N"
"BRI KC JAKARTA RADIO DALAM","AQ6230811","Jl Radio Dalam No 122 Kebayoran Baru","Dki Jakarta","-6.2585,106.78923","N"
"BRI TERAS PASAR RADIO DALAM","AQ6311266","Radio Dalam Kec Kebayoran Baru","Dki Jakarta","-6.25909,106.78919","N"
"BRI UNIT PINANGSIA TIMUR","AQ6266034","Jl Buni No 45a Rt 08 Rw 03","Dki Jakarta","-6.13956,106.81636","N"
"JNE TOMANG   CSC","ADO160015","Jl Tomang Raya No 11","Dki Jakarta","-6.179059,106.797565","N"
"BANK SYARIAH INDONESIA  KCP CIKARANG","ADO514557","Ruko Metro Boulevard Blok A1 2","Jawa Barat","-6.300656,107.15253","N"
"BANK SYARIAH INDONESIA KCP RADIO DALAM","ADO514436","Jl Radio Dalam Raya No 3 Kav 1b C Rt 16","Dki Jakarta","-6.25937,106.78896","N"
"MAYBANK KCP JEMBATAN LIMA","ADO001671","Jl Moch Mansyur 165d","Dki Jakarta","-6.153805,106.80783","N"
"BRI TERAS PASAR KRUKUT","AQ6310397","Jl Kemenangan No 3 Glodok","Dki Jakarta","-6.14446,106.81287","N"
"PEGADAIAN CP RADIO DALAM","ADO192003","Jl Radio Dalam Raya No 14d","Dki Jakarta","-6.262399,106.788747","N"
"BRI UNIT HASYIM ASHARI","AQ6292565","Jl Kh Hasyim Ashari No 117 Kel Cideng","Dki Jakarta","-6.16621,106.80129","N"
"BRI UNIT HASYIM ASHARI","AQ6266407","Jl Kh Hasyim Ashari No 117 Kel Cideng","Dki Jakarta","-6.16621,106.80129","N"
"BRI KCP RSU FATMAWATI","AQ6293797","Jl Rs Fatmawati Cilandak","Dki Jakarta","-6.29454,106.79544","N"
"BRI KCP RS FATMAWATI","AQ6233726","Jl Rs Fatmawati Cilandak","Dki Jakarta","-6.29454,106.79544","N"
"BRI KK CIPETE","AQ6237566","Jl Fatmawati Raya Cilandak","Dki Jakarta","-6.29454,106.79543","N"
"BRI UNIT TOMANG","AQ6292466","Jl Mandala Utara Raya 28 A","Dki Jakarta","-6.17069,106.79942","N"
"BRI UNIT TOMANG","AQ6266067","Jl Mandala Utara Raya 28 A","Dki Jakarta","-6.17069,106.79942","N"
"PEGADAIAN UPS DEPOK TIMUR","ADO506891","Jl Bahagia Raya Blok 32 No 2a","Jawa Barat","-6.378063,106.849484","N"
"PT POS KPC JAKBAR TANAH SAREAL","ADO078923","Jl Pekapuran Iii No 24 Tambora","Dki Jakarta","-6.150243,106.808572","N"
"BANK SYARIAH INDONESIA KCP MARGONDA","ADO510762","Jl Margonda Raya No 499 Rt 04 Rw 07","Jawa Barat","-6.36241,106.83332","N"
"BRI UNIT PEKAPURAN JAKARTA","AQ6268355","Jl Raya Pekapuran Sukatani Cimanggis","Jawa Barat","-6.39915,106.87708","N"
