"name","orig_id","streetAddress","state","location","platinum"
"BRI KK KAWASAN INDUSTRI PULO GADUNG","AQ6237115","Kaw Industri Pulo Gadung Jl Rw Teratai","Dki Jakarta","-6.19473,106.91125","N"
"PT POS KPC JAKTIM PINANGRANTI","ADO170278","Jl Raya Pondok Gede No 3","Dki Jakarta","-6.285319,106.913575","N"
"PEGADAIAN CP PLAZA PONDOK GEDE","ADO470479","Komp Ruko Plaza Pondok Gede Blok G No 1","Jawa Barat","-6.282837,106.91166","N"
"BRI UNIT GRAND WISATA TAMBUN","AQ6267190","Rk Setia Darma Jl Raya Kalimalang","Jawa Barat","-6.27067,107.04672","N"
"PT POS KPC JAKTIM PONDOKBAMBU","ADO112441","Jl Pahlawan Revolusi Blok Q Ii 3","Dki Jakarta","-6.231927,106.897385","N"
"BRI TERAS PASAR SENTRA SS KLENDER","AQ6310078","Jl Raya Bekasi Timur","Dki Jakarta","-6.2126,106.90133","N"
"PEGADAIAN UPC MALL PD BAMBU SPOT","ADO470929","Mall Pondok Bambu Spot Giant Kel","Dki Jakarta","-6.23236,106.897158","N"
"BRI UNIT PONDOK GEDE KRAMAT JATI","AQ6268113","Jl Raya Jatimakmur No 13a Pondok Gede","Jawa Barat","-6.28549,106.91283","N"
"PEGADAIAN UPC PAHLAWAN REVOLUSI","ADO424676","Jl Pahlawan Revolusi No 9c Kel","Dki Jakarta","-6.216647,106.899879","N"
"BRI UNIT NAROGONG BEKASI","AQ6267101","Jl Raya Narogong Km 11","Jawa Barat","-6.31561,106.98804","N"
"BRI KCP HANKAM RAYA","AQ6293786","Ged Utama Lotta Sera Jl Ry Hankam No 35","Jawa Barat","-6.28635,106.91326","N"
"BRI KCP HANKAM RAYA","AQ6233683","Ged Utama Lotta Sera Jl Ry Hankam No 35","Jawa Barat","-6.28635,106.91326","N"
"BRI UNIT PONDOK BAMBU KALIMALANG","AQ6266265","Jl Pahlawan Revolusi No 40 A4 A5","Dki Jakarta","-6.23255,106.89687","N"
"PEGADAIAN UPC PAPAN MAS","ADO471052","Jl Dusun Mekar Sari Barat No 20","Jawa Barat","-6.2314,107.0542","N"
"BRI KCP PONDOK GEDE","AQ6233375","Komp Pondok Gede Plaza Blok A 20","Jawa Barat","-6.2833,106.91077","N"
"PEGADAIAN UPC BANTAR GEBANG","ADO425677","Jl Raya Narogong Km 11 No 4","Jawa Barat","-6.316383,106.986792","N"
"BRI KCP CAKUNG TIPAR","AQ6233188","Jl Tipar Cakung","Dki Jakarta","-6.1703,106.93487","N"
"BANK SYARIAH INDONESIA KCP JATIWARINGIN","AQ6381632","Jl Raya Jatiwaringin No 89 Rt 02 Rw 03","Jawa Barat","-6.283915,106.910563","N"
"BANK SYARIAH INDONESIA KC BEKASI SQUARE","AQ6381555","Jl Ahmad Yani Revo Town Mall No 60 61","Jawa Barat","-6.283915,106.910563","N"
"BRI TERAS PASAR KECAPI","AQ6311134","Pasar Kecapi Jl Raya Kecapi","Jawa Barat","-6.30542,106.93342","N"
"MAYBANK KCP PONDOK GEDE","ADO000779","Pondok Gede Plaza Blok B1 14 16","Dki Jakarta","-6.284115,106.910495","N"
"PEGADAIAN CP PONDOK BAMBU","ADO191848","Jl Pahlawan Revolusi No 35 Kel","Dki Jakarta","-6.232174,106.895913","N"
"BANK SYARIAH INDONESIA KCP PONDOK GEDE","AQ6381588","Plaza Pondok Gede Ruko Blok A Nomor 01","Jawa Barat","-6.284526,106.910545","N"
"BANK BJB KCP PULOGADUNG","ADO204874","Jl Kawasan Industri Pt Jiep","Dki Jakarta","-6.185051,106.916005","N"
"BRI KCP PULOGADUNG TRADE CENTER","AQ6233144","Ruko Pulogadung Trade Center Ptc Blok I","Dki Jakarta","-6.18284,106.91639","N"
"BANK BJB KCP PEMKAB CIANJUR","ADO204478","Jl Siti Jenab No 65 Cianjur","Jawa Barat","-6.244282,106.894462","N"
"PEGADAIAN UPC CAKUNG","ADO192124","Jl Raya Tipar Cakung N0 1a Rt05 Rw08","Dki Jakarta","-6.168072,106.934342","N"
"BRI TERAS PASAR DEPROG","AQ6299870","Jl Cipinang Muara Iii Rt 8 Rw 8","Dki Jakarta","-6.220346,106.89546","N"
"PEGADAIAN UPC JATILUHUR","ADO425578","Jl Wibawa Mukti Ii No 59 Jatiluhur","Jawa Barat","-6.315873,106.949955","N"
"BRI KK VILLA NUSA INDAH","AQ6237258","Ruko Villa Nusa Indah 2 Blk Gg 10 No 6","Jawa Barat","-6.3197,106.9687","N"
"BRI UNIT PULOGADUNG JAKARTA","AQ6292686","Jl Raya Bekasi Km 18 No 3","Dki Jakarta","-6.19485,106.90528","N"
"BRI UNIT PULOGADUNG JAKARTA","AQ6266759","Jl Raya Bekasi Km 18 No 3","Dki Jakarta","-6.19485,106.90528","N"
"BANK SYARIAH INDONESIA KCP PULO GADUNG","ADO512984","Ruko Pulo Gadung Trade Center","Dki Jakarta","-6.18112,106.91588","N"
"BRI TERAS PASAR TAMBUN","AQ6311420","Jl Raya Hasanudin No 34","Jawa Barat","-6.26061,107.05537","N"
"PEGADAIAN UPC JATINEGARA","ADO424610","Jl Bekasi Km 17 No 6 Pulogadung Kel","Dki Jakarta","-6.202382,106.90036","N"
"BRI UNIT TARUMAJAYA BEKASI","AQ6266968","Jl Raya Pasar Baru Bojong","Jawa Barat","-6.16111,107.00646","N"
"PEGADAIAN UPC BUMYAGARA","ADO503469","Ruko Monaco Blok Cb 4 No 4 Kel Kec","Jawa Barat","-6.304,107.0271","N"
"PEGADAIAN UPC ROROTAN","ADO454080","Jl Rorotan Iii","Dki Jakarta","-6.157875,106.953194","N"
"MAYBANK KCP GRAND WISATA","ADO007600","Rk Grand Wisata Blk Aa 9 N 23 Tambun","Jawa Barat","-6.281657,107.047623","N"
"PEGADAIAN CP TAMBUN","ADO191518","Jl Sultan Hasanuddin No 181 Kel","Jawa Barat","-6.260589,107.056828","N"
"PEGADAIAN UPC MUSTIKA JAYA","ADO503470","Ruko Graha Harapan Blok B2 Kel Kec","Jawa Barat","-6.3022,107.0301","N"
"PEGADAIAN UPC SETU CIPAYUNG","ADO453803","Jl Raya Setu Cipayung No 29 Rt06 Rw04","Dki Jakarta","-6.3173,106.9466","N"
"BRI UNIT BOJONG KULUR BEKASI","AQ6267408","Jl Ciangsana Raya Ruko No 22 Rt 02 Rw 08","Jawa Barat","-6.3225,106.97668","N"
"PT POS KPC BEKASI BANTAR GEBANG","ADO074095","Jl Raya Narogong","Jawa Barat","-6.322252,106.984157","N"
"BRI UNIT PASAR PALAD JAKARTA","AQ6266737","Jl Raya Bekasi Timur Km 19 No 30","Dki Jakarta","-6.18901,106.90624","N"
"BRI UNIT PASAR PALAD JAKARTA","AQ6292664","Jl Raya Bekasi Timur Km 19 No 30","Dki Jakarta","-6.18901,106.90624","N"
"BRI UNIT MANGUN JAYA TAMBUN","AQ6267200","Jl Ry Mangunjaya Kamp Siluman No 88 89","Jawa Barat","-6.24819,107.06022","N"
"PEGADAIAN UPC PASAR MANGUN JAYA","ADO425194","Jl Psr Mini Mangunjaya Kel Srijaya","Jawa Barat","-6.25213,107.059661","N"
"PEGADAIAN UPC CIPINANG MUARA 2","ADO503678","Jl Cipinang Muara Raya No 14 Rt 02 04","Dki Jakarta","-6.22233,106.891633","N"
"BRI UNIT CIPINANG RAWAMANGUN","AQ6266715","Jl Raya Bekasi Timur No 358 E","Dki Jakarta","-6.21019,106.89487","N"
"BRI TERAS PASAR BOJONGKULUR","AQ6310825","Jl Villa Nusa Indah2 Blok Z6 No 12","Jawa Barat","-6.32331,106.97592","N"
"PEGADAIAN UPC GRIYA WARTAWAN","ADO453836","Jl Griya Wartawan No 9 Rt12 01 Kel","Dki Jakarta","-6.2177,106.8921","N"
"BANK SYARIAH INDONESIA KCP TAMBUN 2","AQ6381577","Jl Sultan Hasanudin No 6a Rt 003 Rw 003","Jawa Barat","-6.261074,107.058471","N"
"PT POS KPRK JAKARTA TIMUR","ADO040027","Jl Pemuda No 79 Rawamangun","Dki Jakarta","-6.193984,106.901189","N"
"PT POS MPS JAKARTATIMUR 1","ADO178726","Jl Pemuda No 79 Rawamangun","Dki Jakarta","-6.193974,106.901194","N"
"BRI UNIT PINANG RANTI KRAMAT JATI","AQ6267189","Jl Raya Pondok Gede Rt 4 8 No 28 B","Jawa Barat","-6.28519,106.90264","N"
"PEGADAIAN UPC LAYUR","ADO470721","Jl Layur Selatan No 5 Kel Jati","Dki Jakarta","-6.201452,106.89698","N"
"BRI UNIT BIDARA CINA JAKARTA","AQ6266155","Jl Jend Basuki Rahmat No 46","Dki Jakarta","-6.22901,106.88903","N"
"BRI TERAS PASAR PULOGADUNG","AQ6310100","Jl Raya Bekasi Timur","Dki Jakarta","-6.18674,106.9056","N"
"BANK SYARIAH INDONESIA KCP LUBANG BUAYA","AQ6381698","Jl Pondok Gede No 18 H Rt 04 Rw 08","Dki Jakarta","-6.285326,106.90245","N"
"BRI TERAS PASAR MINI TAMBUN","AQ6311398","Jl Mekar Sari Mangunsari Tambun","Jawa Barat","-6.2454,107.06248","N"
"PEGADAIAN UPC BOJONG RAWA LUMBU","ADO470237","Jl Lumbu Utara Raya No 9a Blok Iv Kel","Jawa Barat","-6.192,107.0495","N"
"PEGADAIAN UPC DUKUH ZAMRUD","ADO425150","Jl Dukuh Zamrud Utara Blok S No 53 Kel","Jawa Barat","-6.31218,107.021985","N"
"PT POS LE MANGUNJAYA","ADO179617","Ruko Tambun Square Blok B No 1","Jawa Barat","-6.245339,107.063061","N"
"BRI TERAS PASAR CIPINANG MUARA","AQ6299892","Jl Cipinang Muara Rt 5 Rw 4 No 65","Dki Jakarta","-6.22055,106.889394","N"
"BRI KK HALIM PERDANA K","AQ6236565","Komplek Pasar Mini Indah","Dki Jakarta","-6.25184,106.88833","N"
"BANK SYARIAH INDONESIA KCP TAMBUN 3","AQ6381643","Tambun City Rc No 06","Jawa Barat","-6.269532,107.05838","N"
"PT POS KPC JAKTIM CIPINANG MUARA","ADO079638","Jl I Gusti Ngurahrai No 22 Klender","Dki Jakarta","-6.213705,106.890464","N"
"BRI UNIT BABELAN KOTA","AQ6266935","Jl Raya Kebalen Nomor 10 Rt 01 Rw 01","Jawa Barat","-6.17071,107.03259","N"
"PT POS LE ROROTAN","ADO174579","Jl Malaka Iv No 74","Dki Jakarta","-6.152017,106.955943","N"
"BRI UNIT TELAGA ASIH","AQ6268531","Ds Telaga Asih Kec Cikarang Barat","Jawa Barat","-6.275583,107.05635","N"
"BRI UNIT TAMBUN","AQ6267244","Jl Raya Sultan Hasanuddin Tambun","Jawa Barat","-6.26196,107.06198","N"
"BANK BJB KCP CILEUNGSI","ADO201178","Jl Raya Cileungsi Jonggol Km 1 Rt 02","Jawa Barat","-6.255423,106.887527","N"
"PEGADAIAN UPC JEJALEN","ADO503436","Ruko Perum Tambun Blok K12 No 20 Kel","Jawa Barat","-6.237116,107.065322","N"
"BRI UNIT PEGANGSAAN DUA JAKARTA","AQ6292532","Jl Arteri Kelapa Gading","Dki Jakarta","-6.16963,106.91749","N"
"BRI UNIT PEGANGSAAN DUA JAKARTA","AQ6266276","Jl Arteri Kelapa Gading Ruko Fifhty No17","Dki Jakarta","-6.16963,106.91749","N"
"PEGADAIAN UPC GADING PRATAMA","ADO429341","Jl Suluang K 12 Kelapa Gading","Dki Jakarta","-6.175323,106.911112","N"
"BANK SYARIAH INDONESIA KC KLP GADING 1","ADO511774","Komp Graha Boulevard Blok Kgc No A03","Dki Jakarta","-6.18154,106.90531","N"
"BRI UNIT JATI MURNI KRAMAT JATI","AQ6268102","Jl Raya Hankam No 387 Rt 03 Rw 05","Jawa Barat","-6.31258,106.92429","N"
"PEGADAIAN UPS CIPINANG ELOK","ADO507067","Wisma Elok Blk J Jl Cipinang Muara No136","Dki Jakarta","-6.220727,106.886649","N"
"PEGADAIAN UPC TARUNA","ADO470776","Jl Taruna Raya No 118 Kel Pulo Gadung","Dki Jakarta","-6.187148,106.900585","N"
"PEGADAIAN UPC JATIWARNA","ADO503360","Jl Raya Hankam No 96 Jatimelati","Jawa Barat","-6.313378,106.924693","N"
"PT POS LE CBI KLAPANUNGGAL","ADO175129","Jl Narogong Bekasi No 99","Jawa Barat","-6.328723,106.981434","N"
"BRI UNIT CIPINANG ELOK JAKARTA","AQ6266166","Kav Aneka Elok Blok J No 136","Dki Jakarta","-6.22228,106.8858","N"
"BRI KK TARUNA","AQ6237137","Jl Taruna Jaya No 39 Kav J No 215 Jati","Dki Jakarta","-6.18741,106.89994","N"
"BANK SYARIAH INDONESIA KCP CIPINANG JY","ADO515844","Jl Cipinang Jaya No 11 B C","Dki Jakarta","-6.21777,106.88646","N"
"PEGADAIAN UPC CIPINANG BARU","ADO424522","Jl Cipinang Baru Raya No 33 Kel Cipinang","Dki Jakarta","-6.206043,106.890016","N"
"BRI TERAS PASAR MALAKA","AQ6310221","Jl Rorotan Kel Rorotan Cilincing","Dki Jakarta","-6.14913,106.95568","N"
"BRI UNIT ROROTAN JAKARTA","AQ6292521","Jl Raya Rorotan Kel Rorotan Cilincing","Dki Jakarta","-6.1491,106.95572","N"
"BRI UNIT ROROTAN JAKARTA","AQ6266243","Jl.raya Rorotan Kel Rorotan Cilincing","Dki Jakarta","-6.1491,106.95572","N"
"PT POS KPC JAKTIM CIPINANG BESAR SELATAN","ADO079627","Jl Cipinang Besar Selatan Raya","Dki Jakarta","-6.228058,106.884197","N"
"PT POS LE KELAPALILIN","ADO174612","Jl Bangun Cipte Sarana No 16","Dki Jakarta","-6.176835,106.907133","N"
"PT POS KPC KPC KOLANG","ADO044472","Jl Sibolga Barus Km24 Kolang","Sumatera Utara","-6.251484,106.884274","N"
"BRI UNIT RAWAMANGUN JAKARTA","AQ6266771","Jl Sunan Sedayu No 1","Dki Jakarta","-6.19734,106.89175","N"
"BRI TERAS PASAR KELAPA GADING TIMUR","AQ6310111","Jl Pasar Inpres Rt 6 Rw 6 No 33","Dki Jakarta","-6.176124,106.906117","N"
"BANK SYARIAH INDONESIA KCP TAMBUN 1","ADO512401","Jl Sultan Hasanuddin No 1 Depan Koramil","Jawa Barat","-6.26283,107.06571","N"
"PT POS KPC JAKTIM JATI RAWAMANGUN","ADO079605","Jl Pilo Asem Utara Xii Pulo Gadung","Dki Jakarta","-6.188283,106.896678","N"
"PT POS LE BONGO","ADO174634","Jl Bongo Ivktr Rw 08","Dki Jakarta","-6.170964,106.910898","N"
"PEGADAIAN UPC PASAR RAWAMANGUN","ADO470710","Jl Pegambiran No 25 Kel Rawamangun","Dki Jakarta","-6.1988,106.8907","N"
"PT POS KPC JAKTIM PULOGADUNG","ADO170256","Jl Taruna Kayumas Pulogadung","Dki Jakarta","-6.183612,106.899275","N"
"PT POS KPC JAKTIM LUBANGBUAYA","ADO170344","Jl Masjid Albado No 1","Dki Jakarta","-6.294642,106.900282","N"
"BANK BJB KCP BABELAN","ADO202773","Jl Raya Babelan No 20","Jawa Barat","-6.174327,107.044502","N"
"PT POS KPC BEKASI JATIRAHAYU","ADO044658","Jl Raya Hankam","Jawa Barat","-6.316943,106.92399","N"
"BRI TERAS PASAR PAGI RAWAMANGUN","AQ6310144","Jl Pengambiran Raya Blok A No 1","Dki Jakarta","-6.19836,106.89005","N"
"BRI UNIT CAKUNG JAKARTA RAWAMANGUN","AQ6266704","Ruko Ujung Menteng Blok B22","Dki Jakarta","-6.19836,106.89005","N"
"BRI KC JAKARTA RAWAMANGUN","AQ6230460","Jl Pemuda Kav79 A Kel Jati","Dki Jakarta","-6.19378,106.8921","N"
"BRI TERAS PASAR CIPLAK","AQ6299968","Jl Pancawarga No 1 Cip Besar Selatan","Dki Jakarta","-6.23628,106.88087","N"
"PEGADAIAN UPC FLAMBOYAN","ADO476837","Jl Flamboyan Blok A No 5","Dki Jakarta","-6.170313,106.909575","N"
"BANK SYARIAH INDONESIA KCP JKT RW MANGUN","ADO510168","Jl Paus No 86 Rawamangun","Dki Jakarta","-6.194911,106.89095","N"
"PEGADAIAN UPC WIBAWA MUKTI","ADO425699","Jl Wibawa Mukti Ii No 62 Jati Asih","Jawa Barat","-6.170214,106.909248","N"
"BANK BJB KC RAWAMANGUN","ADO202454","Jl Pemuda No 97 Rawa Mangun","Dki Jakarta","-6.193219,106.891479","N"
"PEGADAIAN UPC PURI HARAPAN","ADO470798","Kampung Kepu Kel Kali Abang Tengah","Jawa Barat","-6.155,107.0215","N"
"BRI UNIT PULOMAS JAKARTA RAWAMANGU","AQ6266760","Jl Raya Balap Sepeda No 61 F","Dki Jakarta","-6.19313,106.89142","N"
"BRI KK BKKBN","AQ6236972","Jl Permata No 1 Halim Perdana Kusuma","Dki Jakarta","-6.25389,106.8808","N"
"BANK SYARIAH INDONESIA KCP RAWAMANGUN","AQ6381720","Ruko Griya 87 Jl Paus Blok A Kav No 87d","Dki Jakarta","-6.195265,106.889165","N"
"BRI UNIT IMIGRASI JAKARTA","AQ6266649","Jl Cipinang Latihan Rt 12 Rw 13 No 12a","Dki Jakarta","-6.21532,106.88163","N"
"BRI KK DIVRE BULOG EX PSR BESAR CIPINANG","AQ6237126","Perum Divre Bulog Jl Perintis","Dki Jakarta","-6.21287,106.88193","N"
"BRI KK DIVRE BULOG EX PSR BESAR CIPINANG","AQ6294237","Perum Divre Bulog Jl Perintis","Dki Jakarta","-6.21287,106.88193","N"
"BRI KK DIVRE BULOG EX PSR BESAR CIPINANG","AQ6296196","Perum Divre Bulog Jl Perintis","Dki Jakarta","-6.21287,106.88193","N"
"PEGADAIAN UPC TRIDAYA","ADO471074","Jl Mangunjaya Utara","Jawa Barat","-6.235685,107.072648","N"
"PT POS KPC TAMBUN","ADO130711","Jl Sultan Hasanudin N 265","Jawa Barat","-6.264565,107.069484","N"
"PT POS KPC TAMBUN","ADO179925","Jl Tadulako No 53","Sulawesi Tengah","-6.264568,107.069485","N"
"PEGADAIAN UPC SIAK BEA CUKAI","ADO450635","Jl Siak Blok J5 No 16","Dki Jakarta","-6.155978,106.923284","N"
"PEGADAIAN UPC BALAI PUSTAKA","ADO470819","Jl Balai Pustaka Timur No 12 Kel","Dki Jakarta","-6.199613,106.885707","N"
"BRI TERAS PASAR PRUMPUNG","AQ6310155","Jl Prumpung Tengah Rt 09 Rw 06 No 29a","Dki Jakarta","-6.22125,106.87878","N"
"PT POS KPC JAKTIM RAWAMANGUN","ADO112616","Jl Balai Pustaka Baru No 843","Dki Jakarta","-6.197929,106.88582","N"
"BRI UNIT RS PERSAHABATAN JAKARTA","AQ6266782","Jl Persahabatan Raya No 1","Dki Jakarta","-6.20259,106.88377","N"
"BRI UNIT RS PERSAHABATAN JAKARTA","AQ6292697","Jl Persahabatan Raya No 1","Dki Jakarta","-6.20259,106.88377","N"
"BRI KCP SUNAN GIRI RAWAMANGUN","AQ6233166","Jl Balai Pustaka B 5 Rawamangun","Dki Jakarta","-6.1971,106.88588","N"
"BRI KK PERUMNAS","AQ6237072","Ged Perum Perumnas Lt 1","Dki Jakarta","-6.24167,106.87682","N"
"PEGADAIAN UPC HALIM","ADO470084","Jl Komodor Halim Perdana Kusumah No 01","Dki Jakarta","-6.265533,106.880511","N"
"BRI TERAS PASAR PROYEK","AQ6310254","Jl Manunggal Semper Sukapura Cilincing","Dki Jakarta","-6.15316,106.92572","N"
"BRI TERAS ROROTAN","AQ6310232","Jl Malaka 2 Rorotan Cilincing","Dki Jakarta","-6.14161,106.95598","N"
"BRI UNIT KAYU PUTIH JAKARTA","AQ6292653","Pertokoan Pulomas B4 9","Dki Jakarta","-6.17835,106.89656","N"
"BRI UNIT KAYU PUTIH JAKARTA","AQ6266726","Pertokoan Pulomas B4 9","Dki Jakarta","-6.17835,106.89656","N"
"PT POS LE KELAPAGADINGTIMUR","ADO174601","Jl Kepala Kopyor Timur Iii Blok Bh2 No 2","Dki Jakarta","-6.169399,106.904096","N"
"BRI TERAS PASAR GEMBRONG LAMA","AQ6299913","Jl Rawa Sawah I","Dki Jakarta","-6.22429,106.87645","N"
"PEGADAIAN UPC JENGKI","ADO453694","Jl Jengki No 25a Kebon Pala","Dki Jakarta","-6.260767,106.877943","N"
"BRI TERAS PASAR BABELAN","AQ6310474","Jl Raya Babelan Depan Pasar Babelan","Jawa Barat","-6.16664,107.04545","N"
"PEGADAIAN UPC GADING ELOK","ADO454123","Jl Gading Elok Raya Utara No 10","Dki Jakarta","-6.164,106.9085","N"
"PT POS LE JATIMURNI","ADO175217","Jl Raya Kp Sawah","Jawa Barat","-6.328647,106.93295","N"
"BRI KK KWDEPAG","AQ6236631","Jl Di Panjaitan No 10","Dki Jakarta","-6.22987,106.8753","N"
"PEGADAIAN UPS PISANGAN LAMA","ADO855458","Jl Pisangan Lama Iii No 9b","Dki Jakarta","-6.210283,106.878823","N"
"PEGADAIAN UPS EMBRIO","ADO507342","Jl Kerja Bakti No 08","Dki Jakarta","-6.2759,106.8821","N"
"PEGADAIAN CP KEBON NANAS","ADO191871","Jl Di Panjaitan Kav 31 Cipinang Cempedak","Dki Jakarta","-6.22889,106.875086","N"
"BRI UNIT PISANGAN LAMA JAKARTA","AQ6266748","Jl Pisangan Lama Iii No 03","Dki Jakarta","-6.20916,106.8788","N"
"BRI UNIT PISANGAN LAMA JAKARTA","AQ6292675","Jl Pisangan Lama Iii No 03","Dki Jakarta","-6.20916,106.8788","N"
"PT POS KPC JAKTIM CIPINANG CEMPEDAK","ADO170267","Jl Otista Iii Blok 11 No 2 Rt 15 Rw 02","Dki Jakarta","-6.234306,106.874477","N"
"BRI KK PULOMAS","AQ6294149","Lobby Rumah Sakit Admira","Dki Jakarta","-6.18261,106.89119","N"
"BRI KK PULOMAS","AQ6296107","Lobby Rumah Sakit Admira","Dki Jakarta","-6.18261,106.89119","N"
"BANK BJB KCP TAMBUN","ADO206601","Jl Sultan Hasanudin No 263 265","Jawa Barat","-6.26632,107.072861","N"
"BANK SYARIAH INDONESIA KCP GADING BOULV","AQ6381182","Jl Bulevard Timur Blok Nb1 No 29","Dki Jakarta","-6.162338,106.908787","N"
"BRI KCP GADING BOULEVARD TIMUR","AQ6233199","Jl Boulevard Timur Blok Nb 1 43","Dki Jakarta","-6.16214,106.90851","N"
"BRI TERAS PASAR KAM","AQ6299957","Jl Otista 3 Blok C 16 17 Rt 02 Rw 04","Dki Jakarta","-6.231358,106.873863","N"
"BRI KK INDRA KARYA","AQ6237687","Apartment The Hive Jl Di Panjaitan Kav34","Dki Jakarta","-6.24553,106.87369","N"
"BRI KK KEJARI JAKTIM EX ASABRI JKT","AQ6294215","Jl Bekasi Timur 4 No 1","Dki Jakarta","-6.21573,106.87573","N"
"BRI KK KEJARI JAKTIM EX ASABRI JAKARTA","AQ6237016","Jl Bekasi Timur 4 No 1","Dki Jakarta","-6.21573,106.87573","N"
"BRI KK ASABRI JAKARTA","AQ6236729","Jl Mayjen Sutoyo No 11 Cililitan","Dki Jakarta","-6.21573,106.87573","N"
"BRI KK KEJARI JAKTIM EX ASABRI JKT","AQ6296174","Jl Bekasi Timur 4 No 1","Dki Jakarta","-6.21573,106.87573","N"
"BRI UNIT VILA GADING PERMAI JKT TJ","AQ6266913","Jl Tipar Cakung Kampung Rengas 4","Dki Jakarta","-6.16941,106.89979","N"
"PEGADAIAN UPS KAYU JATI RAWA BENING","ADO507913","Jl Mas Mansyur 25b","Dki Jakarta","-6.1913,106.8844","N"
"BRI KCP GADING ELOK","AQ6233209","Jl Klp Gading Boulevard Blok Ta 2 34","Dki Jakarta","-6.16854,106.90051","N"
"BRI TERAS PASAR ENJO","AQ6310133","Jl Pisangan Lama","Dki Jakarta","-6.21307,106.87596","N"
"BRI UNIT HALIM JAKARTA OTISTA","AQ6268508","Jl Skuadron Halim 24 Rt 8 Rw 13","Dki Jakarta","-6.26849,106.87734","N"
"BRI KC JAKARTA GADING BOULEVARD","AQ6230514","Rukan Graha Summarecon Klp Gading Blk","Dki Jakarta","-6.16964,106.89935","N"
"PEGADAIAN UPS EMPAT DELAPAN","ADO507320","Jl Pinang Ranti Ii No 03","Dki Jakarta","-6.290732,106.887168","N"
"PT POS KPC JAKTIM MABES TNI","ADO170355","Mabes Tni Cilangkap","Dki Jakarta","-6.313189,106.905388","N"
"PEGADAIAN UPC PINANG RANTI","ADO425501","Jl Raya Pinang Ranti No 14 Pinang Ranti","Dki Jakarta","-6.290842,106.887102","N"
"BRI KK KAWASAN BERIKAT NUSANTARA","AQ6236576","Kawasan Berikat Nusantara","Dki Jakarta","-6.14394,106.93513","N"
"PT POS KPC JAKUT KELAPA GADING PERMAI","ADO045208","Jl Kelapa Lilin Raya Blok Ng No 1","Dki Jakarta","-6.159015,106.91005","N"
"BRI UNIT GADING MANDIRI JAKARTA","AQ6266825","Pasar Mandiri Blok M Iv C 33","Dki Jakarta","-6.15964,106.9092","N"
"BRI UNIT GADING MANDIRI JAKARTA","AQ6292718","Pasar Mandiri Blok M Iv C 33","Dki Jakarta","-6.15964,106.9092","N"
"BANK BJB KK BOULEVARD RAYA","ADO205534","Jl Boulevard Raya Blok Tn2 No 29","Dki Jakarta","-6.166872,106.900937","N"
"PT POS KPC JAKTIM TAMAN MINI","ADO112209","Taman Mini Indah Indonesia Kramatjati","Dki Jakarta","-6.285525,106.882982","N"
"BANK BJB KK TMII","ADO200825","Jl Raya Taman Mini","Dki Jakarta","-6.302399,106.893807","N"
"BRI UNIT RS UKI JAKARTA","AQ6266188","Jl Letjen Sutoyo Komplek Uki","Dki Jakarta","-6.25113,106.87206","N"
"BRI UNIT AMPERA JAKARTA","AQ6266199","Jl Pondasi No 37 Kamp Ambon","Dki Jakarta","-6.18614,106.88486","N"
"BRI UNIT AMPERA JAKARTA","AQ6292499","Jl Pondasi No 37 Kampung Ambon","Dki Jakarta","-6.18614,106.88486","N"
"BRI UNIT PEDURENAN TAMBUN","AQ6268124","Perum Kota Legenda Blok B1 No 8","Jawa Barat","-6.267233,107.076267","N"
"BRI TO RS NASIONAL OTAK","AQ6260160","Jl Mt Haryono Kel Cawang Kec Kramat Jati","Dki Jakarta","-6.246004,106.870563","N"
"BRI TO RS NASIONAL OTAK","AQ6318087","Jl Mt Haryono Kel Cawang Kec Kramat Jati","Dki Jakarta","-6.246004,106.870563","N"
"BRI UNIT JATINEGARA KOTA JAKARTA","AQ6266650","Jl Bekasi Timur Pertokoan Rawa Bunga","Dki Jakarta","-6.21543,106.87251","N"
"BRI KK DITJEN BEA & CUKAI","AQ6237027","Kantor Direktorat Bea & Cukai","Dki Jakarta","-6.20605,106.87493","N"
"PT POS KPC JAKTIM KAYUPUTIH","ADO079573","Jl Plitur Raya No 29 Pulo Gadung","Dki Jakarta","-6.185482,106.884099","N"
"BRI KK KODAM JAYA","AQ6237049","Komplek Kodam Jaya Jl Letjen Sutoyo","Dki Jakarta","-6.25358,106.87085","N"
"PT POS KPC JAKTIM HALIM","ADO170289","Jl Skuadron","Dki Jakarta","-6.275938,106.87668","N"
"PT POS LE SOEDIPONEGORO","ADO900734","Jl Diponegoro","Nusa Tenggara Timur","-6.303407,106.892318","N"
"BRI KK TAMAN MINI EX MABES AL CILANGKAP","AQ6237313","Mabes Al Cilangkap","Dki Jakarta","-6.30034,106.88996","N"
"BRI KK TAMAN MINI EX MABES AL CILANGKAP","AQ6296228","Mabes Al Cilangkap","Dki Jakarta","-6.30034,106.88996","N"
"BRI KK TAMAN MINI EX MABES AL CILANGKAP","AQ6294260","Mabes Al Cilangkap","Dki Jakarta","-6.30034,106.88996","N"
"PT POS KPC SUNGAISIRING","ADO170290","Jl Samarinda Bontang Km 41","Kalimantan Timur","-6.276135,106.876272","N"
"PEGADAIAN UPC OTISTA RAYA","ADO503140","Jl Otista Raya No 59 Kel Bidaracina","Dki Jakarta","-6.236,106.8692","N"
"BRI KK MALL KELAPA GADING","AQ6237159","Unit G 175 Lt Dasar Mkg Jl Boulevard","Dki Jakarta","-6.15623,106.90839","N"
"PT POS LE TAMBUNUTARA","ADO900482","Jl Raya H Nausan No 9 Rt 01 Rw 02","Jawa Barat","-6.180936,107.065277","N"
"BRI UNIT CIBITUNG TAMBUN","AQ6267046","Jl Teuku Umar Km 43 Cibitung","Jawa Barat","-6.26726,107.07846","N"
"BRI KCP GADING BOULEVARD RAYA","AQ6233177","Ruko Kelapa Gading Permai","Dki Jakarta","-6.15551,106.90821","N"
"PEGADAIAN UPS CILILITAN BESAR","ADO507122","Jl Cililitan Besar No 104","Dki Jakarta","-6.264428,106.871452","N"
"BANK SYARIAH INDONESIA KCP OTISTA","AQ6382392","Jl Raya Otista No 109 Rt 015 Rw 009","Dki Jakarta","-6.233936,106.867874","N"
"BANK SYARIAH INDONESIA KCP OTISTA","AQ6383964","Jl Raya Otista No 109 Rt 015 Rw 009","Dki Jakarta","-6.233936,106.867874","N"
"PT POS LE JKS PUTRASURYAPRIMA","ADO174469","Gd Graha Pratama Jl Mt Haryono Kav 15","Dki Jakarta","-6.249196,106.86829","N"
"BANK SYARIAH INDONESIA KC KELAPA GADING2","AQ6381104","Jl Boulevard Raya Qa I 1","Dki Jakarta","-6.153975,106.908913","N"
"BRI KK MABES AU CILANGKAP","AQ6237302","Jl Raya Mabes Hankam Cipayung","Dki Jakarta","-6.32844,106.91709","N"
"BANK SYARIAH MANDIRI KCP GADING ORCHARD","ADO515228","Jl Kelapa Hybrida Blok Pf No 18","Dki Jakarta","-6.148755,106.91602","N"
"BRI KK TAMINI SQUARE","AQ6237324","Tamini Square Ground Floor Gb 2 No 1","Dki Jakarta","-6.29133,106.88154","N"
"PEGADAIAN UPC TAMINI SQUARE","ADO424577","Mall Tamini Square Lt Lg Blok Ls 21 3","Dki Jakarta","-6.290878,106.881248","N"
"MAYBANK KC KELAPA GADING","ADO602788","Jl Raya Boulevard Barat Blok C5 9","Dki Jakarta","-6.158637,106.902899","N"
"MAYBANK KC JATINEGARA","ADO000515","Ji Jatinegara Timur 59","Dki Jakarta","-6.220616,106.868589","N"
"BRI KC TAMBUN","AQ6230701","Ruko Tambun City Blok Rc1 Re1 Re2","Jawa Barat","-6.26761,107.07994","N"
"PEGADAIAN UPC KRAMAT ASEM","ADO470491","Jl Kramat Asem Utan Kayu","Dki Jakarta","-6.204354,106.872599","N"
"PT POS KPC JAKTIM CAWANG","ADO112375","Jl Menjid Bendungan Cawang Kramatjati","Dki Jakarta","-6.251222,106.86779","N"
"BRI KK OMNI HOSPITAL","AQ6236608","Jl Pulau Mas 6 No 20","Dki Jakarta","-6.1803,106.88391","N"
"BRI KC JAKARTA OTISTA","AQ6230493","Jl Otista 72","Dki Jakarta","-6.23245,106.86701","N"
"BRI KK JAGORAWI","AQ6357026","Kk Jagorawi","Dki Jakarta","-6.29048,106.8803","N"
"BANK SYARIAH INDONESIA KCP DEWI SARTIKA2","AQ6382381","Jl Dewi Sartika No 349","Dki Jakarta","-6.247361,106.867144","N"
"BANK SYARIAH INDONESIA KCP DEWI SARTIKA2","AQ6383953","Jl Dewi Sartika No 349","Dki Jakarta","-6.247361,106.867144","N"
"PEGADAIAN UPC PS INDUK CLUSTER CIBITUNG","ADO425226","Jl Teuku Umar No 13 Kel Sarimukti","Jawa Barat","-6.267628,107.080368","N"
"BRI TERAS PASAR CIBITUNG","AQ6311376","Blok B1 No 22  16 Jl Raya Teuku Umar","Jawa Barat","-6.26723,107.08056","N"
"PEGADAIAN CPS MALL OF INDONESIA","ADO506693","Jl Raya Kelapa Hibrida Blok Pf 23 No 19","Dki Jakarta","-6.148281,106.914861","N"
"BRI KK BKN","AQ6237083","Jl Mayjen Sutoyo Cawang","Dki Jakarta","-6.258638,106.868256","N"
"BANK SYARIAH INDONESIA KCP GADING","ADO675234","Jl Boulevard Barat Blok Lc 6 No 27","Dki Jakarta","-6.158345,106.90156","N"
"BRI KCP CIBITUNG","AQ6233386","Jl Teuku Umar No. 44a Cikarang Barat","Jawa Barat","-6.26721,107.08097","N"
"BRI UNIT CILILITAN BESAR","AQ6268728","Jl Cililitan Besar No 32 B","Dki Jakarta","-6.26388,106.86923","N"
"BRI UNIT CILILITAN BESAR","AQ6292862","Jl Cililitan Besar No 32 B","Dki Jakarta","-6.26388,106.86923","N"
"BRI TERAS PASAR BULOG","AQ6310045","Jl Raya H Ten Kel Kayu Putih Pulogadung","Dki Jakarta","-6.189372,106.877575","N"
"BANK BJB KCP DEWI SARTIKA","ADO203916","Jl Dewi Sartika No 321 Kel Cawang","Dki Jakarta","-6.248863,106.866432","N"
"MAYBANK KCP KELAPA GADING BOUL","ADO002100","Jl Kelapa Gading Blvd Blok Pa","Dki Jakarta","-6.151108,106.909578","N"
"MAYBANK KCP KELAPA GADING BOUL","ADO001813","Jl Raya Boulevard 1-3 No. 4","Dki Jakarta","-6.151109,106.909575","N"
