"name","orig_id","streetAddress","state","location","platinum"
"BRI UNIT KEDUNG HALANG","AQ6268212","Jl Pomad Kel Ciparigi","Jawa Barat","-6.54777,106.82303","N"
"PT POS LE KUTAWALUYA","ADO176306","Jl Raya Kutagandok No 1 A Rt 02 Rw 01","Jawa Barat","-6.158702,107.312866","N"
"PEGADAIAN CPS PASAR BABAKAN","ADO507496","Jl Perintis Kemerdekaan I No 31","Banten","-6.186614,106.632792","N"
"BANK BJB KCP CIKOKOL","ADO205051","Komp.mahkota Mas J/08 Jl Mh Tamrin","Banten","-6.210724,106.629889","N"
"BRI UNIT PASAR ROYAL","AQ6270972","Perum Taman Royal 1 Ruko Mini No 30 31","Banten","-6.16996,106.63565","N"
"BRI KC TANGERANG A. YANI","AQ6231108","Jl Jend Ahmad Yani No 4","Banten","-6.16996,106.63565","N"
"BRI UNIT PASAR MALABAR","AQ6270961","Jl Cemara Raya No 36 Kel Cibodasari","Banten","-6.16996,106.63565","N"
"BRI UNIT CISEENG DEPOK","AQ6268904","Ruko Tirtamas Blok A No 4","Jawa Barat","-6.44185,106.69552","N"
"BRI UNIT KARANG SATRIA BEKASI","AQ6266946","Jl Raya Karang Satria Blok D02 No 26","Jawa Barat","-6.21773,107.32195","N"
"BANK BJB KK PEMDA TANGERANG","ADO200881","Jl Satria Sudirman No 1","Banten","-6.170707,106.635183","N"
"BANK SYARIAH INDONESIA KC TGR DAAN MOGOT","AQ6381368","Jl Daan Mogot No 39","Banten","-6.169506,106.635338","N"
"PT POS KPC KARAWANG TANJUNGPURA","ADO042326","Jl Proklamasi Karawangbarat","Jawa Barat","-6.338107,107.308142","N"
"MAYBANK KCP GADING SERPONG","ADO001659","Ruko Boulevard Gading Serpong","Banten","-6.241324,106.628039","N"
"BRI KK KPP PRATAMA KOSAMBI","AQ6238017","Jl Perintis Kemerdekaan Ii","Banten","-6.19339,106.63078","N"
"BRI  UNIT BABAKAN MADANG CIBINONG","AQ6267464","Jl Raya Sentul Kel Sentul","Jawa Barat","-6.56546,106.86284","N"
"BRI UNIT GUNUNG PUTRI CIBINONG","AQ6267530","Jl Mercedes Benz No 4","Jawa Barat","-6.56546,106.86284","N"
"PEGADAIAN UPC PASAR JOHAR","ADO503283","Ruko Hotel Shandy No 442d Kel","Jawa Barat","-6.311734,107.315975","N"
"BRI TERAS PASAR BERAS JOHAR","AQ6311309","Jl Cinangoh Pasar Johar","Jawa Barat","-6.31372,107.31564","N"
"PT POS LE WANASARI","ADO175789","Pasar Kaligandu Wanajaya Rt 001 Rw 001","Jawa Barat","-6.319407,107.314801","N"
"PEGADAIAN UPC TELUK JAMBE","ADO470347","Jl Raya Teluk Jambe No31 Dsn Sukamanah","Jawa Barat","-6.337873,107.309847","N"
"PEGADAIAN UPC GAPLEK TIMUR","ADO429363","Dr Setyabudi No 27 Rt 00 Rw 00","Banten","-6.178306,106.631889","N"
"BRI KCP CIKOKOL","AQ6234200","Jl Mh Thamrin No 13 Rt 1 6 Kel Cikokol","Banten","-6.20487,106.62822","N"
"BANK BJB KCP GADING SERPONG","ADO202333","Rk Financial Blok Ba2 27 Jl Boulevard Ry","Banten","-6.250824,106.626489","N"
"BANK BJB KCP PARAMOUNT SERPONG","ADO206876","Ruko Bolsena Blok A No 18","Banten","-6.250824,106.626489","N"
"PT POS CPM MAILING ROOM GARUDA","ADO900415","Pt Garuda City Center Bandara Soeta","Banten","-6.133215,106.642456","N"
"PEGADAIAN CP TANGERANG","ADO191190","Jl A Damjati No 7","Banten","-6.17762,106.63088","N"
"PT POS LE CISAUK","ADO174898","Jl Raya Cisauk No 11 Rt","Banten","-6.333761,106.638855","N"
"BRI TERAS PASAR KELAPA DUA","AQ6311541","Jl Dayung Raya Pasar Kelapa Dua","Banten","-6.23533,106.62533","N"
"BRI UNIT CISAUK PAMULANG","AQ6268894","Serpong Garden Blok C 01 No 23","Jawa Barat","-6.33411,106.63855","N"
"BANK SYARIAH INDONESIA  KCP KARAWACI","ADO519024","Jl Dayung Raya No 35 A B Kel Kelapa Dua","Banten","-6.23498,106.62496","N"
"BRI UNIT KELAPA DUA BSD","AQ6292895","Jl Danau Kelapa Dua Ruko Blk N3 No 6a 6b","Banten","-6.23491,106.62493","N"
"BRI UNIT KELAPA DUA BUMI SERPONG","AQ6270224","Jl Danau Kelapa Dua Ruko Blk N3 No 6a 6b","Banten","-6.23491,106.62493","N"
"MAYBANK KC TANGERANG","ADO000450","Jl Daan Mogot 33","Banten","-6.172887,106.631006","N"
"PT POS MPS KARAWANG 4","ADO178892","Jl Wirasaba Karawangtimur","Jawa Barat","-6.320786,107.316753","N"
"PT POS MPS 1 KARAWANG 1","ADO178902","Jl Wirasaba Karawangtimur","Jawa Barat","-6.320871,107.316828","N"
"PT POS KPC KARAWANG PASARJOHAR","ADO042315","Jl Wirasaba Karawangtimur","Jawa Barat","-6.320879,107.316888","N"
"PT POS KPRK TANGERANG","ADO040654","Jl Daan Mogot No 11","Banten","-6.174754,106.630193","N"
"PEGADAIAN UPC KELAPA DUA","ADO429659","Jl Dayung Raya No 24","Banten","-6.235074,106.624176","N"
"BRI UNIT NEGLASARI TANGERANG","AQ6270125","Jl Dr Sitanala Rt 01 Rw 02","Banten","-6.160414,106.632423","N"
"PEGADAIAN UPS PASAR MODERN PARAMOUNT","ADO507089","Jl Gading Serpong Raya Ruko","Banten","-6.2489,106.6232","N"
"BRI UNIT GERENDENG TANGERANG","AQ6270763","Jl Gatot Subroto Km 1","Banten","-6.17539,106.62783","N"
"BRI KCP IMAM BONJOL","AQ6234189","Jl Imam Bonjol No 42 Karawaci","Banten","-6.18586,106.62598","N"
"BANK BJB KCP BAROS","ADO202146","Jl Raya Pondok Mas No 22","Jawa Barat","-6.547177,106.805717","N"
"PT MADAME EXPRESS REMITINDO KRW TIRTA","AQ6250073","Ds Jatimanggah Rt 07 Rw 02 Desa Bolang","Jawa Barat","-6.076278,107.290001","N"
"BRI KCP SENTUL","AQ6233452","Ruko Bellanova Country Mall Rk 1 No 1","Jawa Barat","-6.56613,106.84502","N"
"BANK SYARIAH INDONESIA KCP SENTUL","ADO515745","Bellanova Country Mall Ruko Blok Rk 8","Jawa Barat","-6.56666,106.84452","N"
"BRI TO MTC PERTAMINA","AQ6260072","Jl Pemuda No 44 Rawamangun","Dki Jakarta","-6.257493,106.619178","N"
"BRI KC TANGERANG MERDEKA","AQ6231120","Jl Merdeka Nomor 110 C G","Banten","-6.17862,106.62352","N"
"BRI SSB RESTA BOGOR","AQ6289860","Jl Raya Kedung Halang No 6","Jawa Barat","-6.551146,106.806522","N"
"KOPERASI PAYU 18","AQ6160422","Cilebut Rt 2 Rw 3 Sukaraja","Jawa Barat","-6.546325,106.796968","N"
"PT POS KPC BOGOR KEDUNG HALANG","ADO170454","Jl Raya Kedunghalang","Jawa Barat","-6.553988,106.808481","N"
"BANK BJB KC CIKARANG","ADO200737","Jl H Usmar Ismail Kav 02 Movieland","Jawa Barat","-6.334241,106.629873","N"
"MAYBANK KK JALAN BARU","ADO008096","Komp Ruko 24 Jl Kh Soleh Iskandar","Jawa Barat","-6.527557,106.764842","N"
"PEGADAIAN UPC BOROBUDUR","ADO477191","Jl Borobudur Raya No 14 Perumnas Ii","Banten","-6.1807,106.6205","N"
"PEGADAIAN UPS PORIS","ADO506824","Jl Kh Maulana Hasanudin","Banten","-6.1844,106.6198","N"
"BANK SYARIAH INDONESIA KCP CIMONE 2","AQ6381380","Jl Merdeka Raya No 21 D","Banten","-6.185612,106.618141","N"
"BRI UNIT PERUMNAS I TANGERANG","AQ6270280","Jl Beringin Raya No 9 Karawaci Baru","Banten","-6.20545,106.61496","N"
"BANK BJB KK RSU TANGERANG","ADO200892","Jl Jend A Yani No 9","Banten","-6.169942,106.619994","N"
"BRI UNIT CIMANGGU BOGOR","AQ6268157","Jl Raya Kh Soleh Iskandar Tanah Sereal","Jawa Barat","-6.54797,106.79","N"
"BANK SYARIAH INDONESIA KCP CIMONE 1","ADO512775","Jl Merdeka No 308 Cimone","Banten","-6.18097,106.61713","N"
"PT POS KPC TANGERANG KARAWACI","ADO080012","Jl Ciujung No 1 Karawaci","Banten","-6.20534,106.613578","N"
"PT POS KPC BOGOR KEDOKTERAN HEWAN","ADO073852","Jl Tmn Kencn Fak Kedokteran Hwn","Jawa Barat","-6.563431,106.814879","N"
"PT POS KPC TANGERANG ISLAMIC VILLAGE","ADO080276","Jl Raya Kelapa Dua Komp Islamigvillage","Banten","-6.241905,106.610984","N"
"BRI TERAS PASAR TU","AQ6310627","Kp Cibadak Kec Tanah Sareal","Jawa Barat","-6.538412,106.77031","N"
"PT POS KPC TANGERANG CIMONE","ADO080023","Jl Proklamasi No 18 Cimone","Banten","-6.186489,106.614232","N"
"PT POS LE BABAKANMADANG","ADO175141","Jl Raya Babakan Madang","Jawa Barat","-6.593841,106.900361","N"
"BRI TERAS MALABAR","AQ6312717","Jl Pasar Malabar Kel Cibodasari","Banten","-6.209483,106.61067","N"
"PEGADAIAN UPS CIBODAS","ADO508398","Jl Raya Kavling Perkebunan No 253b","Banten","-6.219897,106.609905","N"
"PEGADAIAN UPC PASAR BARU","ADO450129","Jl Moh Toha Pasar Baru","Banten","-6.170709,106.615796","N"
"PEGADAIAN UPS MALABAR","ADO507517","Jl Malabar Raya No 14","Banten","-6.209623,106.610466","N"
"PEGADAIAN CP KARAWACI","ADO191640","Jl Proklamasi No 12 12a","Banten","-6.191832,106.612213","N"
"BRI UNIT CIMONE","AQ6270730","Jl Raya Proklamasi No 23","Banten","-6.19028,106.61236","N"
"PT POS KPC TANGERANG CIBODASARI","ADO080265","Jl Nanas Raya No 39a Perum I","Banten","-6.212286,106.610018","N"
"PT POS KPC TANGERANG KARANGSARI","ADO080045","Jl M Toha No 20 Genoa","Banten","-6.170468,106.615358","N"
"PT POS KPC TELUKNAGA","ADO080166","Kampung Melayu Barat Telugnaga","Banten","-6.09565,106.637772","N"
"BRI UNIT MALABAR","AQ6270114","Jl Raya Rorojonggrang Blok 1617","Banten","-6.20825,106.60973","N"
"PT POS LE CISEENG","ADO175008","Jl H Usa Ruko Efo Express","Jawa Barat","-6.451182,106.677148","N"
"MAYBANK KCP SUPERMALL KARAWACI","ADO004937","Supermall Karawaci Blok Lg No 182","Banten","-6.22697,106.608361","N"
"PT POS LE LIPPOKARAWACI","ADO174876","Pusat Jajan Tamansari Lippos","Banten","-6.229156,106.607865","N"
"PEGADAIAN UPC TELUK NAGA","ADO450734","Jl Selembaran Raya No 12 Rt 02 02","Banten","-6.069934,106.648757","N"
"BRI SSB RES KARAWANG","AQ6290057","Jl Suroto Kunto No 110","Jawa Barat","-6.333931,107.330948","N"
"BANK SYARIAH INDONESIA KCP JALAN BARU","ADO511961","Jl Kh Sholeh Iskandar No 77a B","Jawa Barat","-6.56229,106.80365","N"
"PEGADAIAN UPC MALABAR","ADO450943","Jl Palem B 12 Rt 000 Rw 000 Cibodas","Banten","-6.211281,106.607746","N"
"PEGADAIAN UPS SYARIAH JOHAR","ADO854017","Jalan Surotokunto No 5d","Jawa Barat","-6.331,107.3326","N"
"BRI UNIT BUGEL TANGERANG","AQ6270268","Ruko Centra Cimone Blok B No 11 Rt 3 13","Banten","-6.18543,106.61021","N"
"BRI TERAS PASAR KAMPUNG MELAYU","AQ6312696","Jl Poros Kendari Kolaka Ds Awuliti","Banten","-6.071351,106.646512","N"
"BRI UNIT KAMPUNG MELAYU TANGERANG","AQ6270103","Jl Raya Kp Melayu Km 1","Banten","-6.07106,106.64652","N"
"BRI KCP PALEM SEMI","AQ6234299","Jl Parasel Ruko Madrid No 22 Palem Semi","Banten","-6.22592,106.60579","N"
"BRI KCP TANGERANG PASAR BARU","AQ6234190","Ruko M Toha Blok B No 34","Banten","-6.17116,106.61159","N"
"PEGADAIAN UPC SANGHIANG JAYA","ADO451164","Jl M Toha Km 3 6 Rt 000 Rw 000 Periuk","Banten","-6.171671,106.610572","N"
"BRI UNIT WARUNG JAMBU","AQ6268180","Jl Raya Pangkalan Warung Jambu No 2","Jawa Barat","-6.56792,106.80888","N"
"BANK SYARIAH INDONESIA KC TANAH SAREAL","AQ6381939","Jl Raya Sholeh Iskandar Ruko Permata","Jawa Barat","-6.548339,106.774397","N"
"BANK SYARIAH INDONESIA KK WARUNG JAMBU","ADO676125","Jl Pajajaran No 17b Kel Bantarjati","Jawa Barat","-6.56791,106.80872","N"
"PT POS KPC BOJONGNANGKA","ADO080298","Jl Wijaya Kusuma Blok Rc 1 19 Legok","Banten","-6.255439,106.604571","N"
"PEGADAIAN UPS BUKIT CIMANGGU","ADO507694","Bkt Cimanggu City Boulevard Blok A 2 3","Jawa Barat","-6.553971,106.782106","N"
"PEGADAIAN CP WARUNG JAMBU","ADO191859","Jl Raya Pajajaran Ruko No 11 Kel","Jawa Barat","-6.569205,106.808848","N"
"PT POS KPC BOGOR TANAH SAREAL","ADO046209","Jl Perwira","Jawa Barat","-6.567984,106.805506","N"
"PEGADAIAN CPS BOGOR BARU","ADO507353","Ruko Plaza Indahbblok C No 3a","Jawa Barat","-6.5576,106.7858","N"
"BANK BJB KCP TANAH SAREAL","ADO202234","Jl Kh Soleh Iskandar Ruko 24","Jawa Barat","-6.55936,106.78811","N"
"PT POS LE SEPATAN TIMUR","ADO174821","Jl Kedaung Barat Rt 01 02","Banten","-6.152813,106.611808","N"
"BRI TERAS PASAR JAMBU 2","AQ6310759","Pasar Induk Jambu 2 Tanah Sareal","Jawa Barat","-6.570311,106.807632","N"
"BANK SYARIAH INDONESIA KCP BANTARJATI","AQ6382040","Jl Raya Pajajaran No 256b Rt 02 Rw 05","Jawa Barat","-6.570847,106.808401","N"
"BANK SYARIAH INDONESIA KCP BANTARJATI","AQ6383612","Jl Raya Pajajaran No 256b Rt 02 Rw 05","Jawa Barat","-6.570847,106.808401","N"
"PT POS KPC BOGOR CIBADAK","ADO043943","Jl Kh Sholeh Iskandar Km 2","Jawa Barat","-6.553294,106.776484","N"
"JNE BOGOR SHOLEH ISKANDAR","ADO162336","Jl. Soleh Iskandar Ruko 16 No.","Jawa Barat","-6.560839,106.788991","N"
"PEGADAIAN UPC HARAPAN KITA","ADO477146","Jl Harapan Kita Blok C 3 No 11","Banten","-6.219081,106.601792","N"
"BANK BJB KCP PERUMNAS","ADO206579","Jl  Mendut Raya Blok N No  21 22","Banten","-6.215191,106.601852","N"
"BANK SYARIAH INDONESIA KCP MALABAR","ADO512050","Jl Borobudur Raya M 16 17 Bencongan","Banten","-6.21607,106.60155","N"
"BANK BJB KK PASAR CIBINONG","ADO205138","Jl Raden Lukman No 8","Jawa Barat","-6.579016,106.824131","N"
"BANK BJB KK WAROENG TIGARAKSA","ADO206393","Jl Aria Wangsa Kara Rt 002 Rw 08","Banten","-6.180089,106.605384","N"
"BRI TERAS PASAR CICANGKAL","AQ6312047","Blok D1 3 4 Desa Sukamulya Kec Rumpin","Jawa Barat","-6.38695,106.63177","N"
"PT POS KPC TANGERANG PERUMNAS DUA","ADO084555","Jl Mendut Raya No 10 Perumnas Ii","Banten","-6.215028,106.601388","N"
"PT POS LE PAGEDANGAN","ADO174908","Jl Raya Pagedangan","Banten","-6.301459,106.60549","N"
"KOPERASI PAYU 146","AQ6160916","Jl Raya Juntinyuat Rt 09 Rw 01","Jawa Barat","-6.515133,107.227582","N"
"BANK BJB KCP DARMAWANGSA","ADO206744","Jl  Darmawangsa Vi No 23","Dki Jakarta","-6.194023,106.601802","N"
"MAYBANK KCP SURYACIPTA KARAWANG","ADO007358","The Manor Office Park Suryacipta Square","Jawa Barat","-6.371172,107.328121","N"
"JNE BOGOR  GRIYA KENARI MAS","ADO162369","Ruko Griya Kenari Mas Blok A N","Jawa Barat","-6.579239,106.818554","N"
"CABANG BOGOR","ADO920194","Jl Pajajaran No 96 P Q","Jawa Barat","-6.57482,106.807626","N"
"BRI KC BOGOR PADJAJARAN","AQ6230602","Jl Raya Pajajaran No 95a Rt 2 Rw 6","Jawa Barat","-6.57501,106.80752","N"
"BRI TERAS PASAR LOJI","AQ6311299","Jl Raya Loji Cigeuntis Kp Loji","Jawa Barat","-6.516944,107.229559","N"
"BANK SYARIAH INDONESIA KC PAJAJARAN","AQ6381917","Jl Pajajaran Raya No 63","Jawa Barat","-6.575572,106.808188","N"
"PEGADAIAN UPC PASAR BONANG","ADO477508","Komp Ruko Dasana Xentre Blok Bd No 10","Banten","-6.254439,106.596959","N"
"BANK BJB KCP CISAUK","ADO206216","Ruko 5 No 15-16 Serpong Garden","Banten","-6.333745,106.608674","N"
"PT POS KPC TANGERANG TAMAN CIBODAS","ADO044416","Jl Taman Cibodas Raya Bi No 1","Banten","-6.186261,106.599695","N"
"PEGADAIAN UPC YASMIN","ADO503799","Jl Ring Road Raya No 114 Taman Yasmin","Jawa Barat","-6.5548,106.7687","N"
"BANK SYARIAH INDONESIA KCP KARAWACI","AQ6381292","Ruko Mutiara Karawaci Blok B No 27","Banten","-6.219766,106.596164","N"
"BRI TERAS PASAR KONDANGJAYA","AQ6311288","Kp Krajan Ii Rt 03 Rw 02 Ds Kondang Jaya","Jawa Barat","-6.33825,107.34237","N"
"PEGADAIAN UPC BINONG","ADO429088","Jl Binong Raya No 107 Bong Kelapa Dua","Banten","-6.227442,106.594991","N"
"BANK BJB KK BOGOR UTARA","ADO208373","Jl  Ahmad Adnawijaya No  68","Jawa Barat","-6.582838,106.817483","N"
"JNE BOGOR","ADO160103","Bogor Sawo Jajar","Jawa Barat","-6.573122,106.797272","N"
"BRI TERAS PASAR LAPANGAN BOLA","AQ6311826","Jl Tanggul Barat Pasar Lapangan Bola","Dki Jakarta","-6.16985,106.60058","N"
"BRI UNIT SANGIANG TANGERANG MERDEK","AQ6270323","Jl Prabu Kian Santang No 11 Kel Sangiang","Banten","-6.16985,106.60058","N"
"BRI UNIT ANGKE JELAMBAR","AQ6271193","Jl Jembatan Besi Ii No 44 Rt 05 Rw 03","Dki Jakarta","-6.16985,106.60058","N"
"PEGADAIAN UPC BANGBARU 1 WARU","ADO453825","Jl Bangbarung No 62 Kel Bantarjati","Jawa Barat","-6.581617,106.813477","N"
"BANK SYARIAH INDONESIA KC AHMAD YANI","AQ6388541","Jl Ahmad Yani No 19","Jawa Barat","-6.575502,106.800258","N"
"BRI KK PASAR MUTIARA","AQ6238095","Gedung Kpp Pratama Tigaraksa","Banten","-6.22448,106.59343","N"
"BRI KK INDRAPRASTA","AQ6237346","Jl Panduraya No 49 Indraprasta","Jawa Barat","-6.58436,106.81723","N"
"PT POS KPC MANGGAR","ADO074040","Jl Jend Sudirman Kp Baru Manggar Manggar","Bangka Belitung","-6.345923,107.342642","N"
"BRI KK TASPEN BOGOR","AQ6237500","Jl Raya Padjajaran No 99","Jawa Barat","-6.57978,106.80655","N"
"PT POS KPC KARAWANG ANGGADITA","ADO171312","Jl Raya Gintungkerta Karawang","Jawa Barat","-6.34606,107.343057","N"
"PEGADAIAN UPC SALABENDA","ADO471337","Jl Raya Salabenda No 73 Rt03 Rw02 Kemang","Jawa Barat","-6.555895,106.76163","N"
"BRI UNIT CIMAHPAR BOGOR","AQ6268191","Jl Raya Cimahpar Kel Cimahpar","Jawa Barat","-6.591197,106.827588","N"
"BRI UNIT SEMPLAK BOGOR","AQ6267365","Jl Raya Semplak No 27a Rt 002 Rw 001","Jawa Barat","-6.55687,106.76192","N"
"PEGADAIAN UPC CEMPALA","ADO470699","Jl Brigjen Saptadji Hadiprawira No 170","Jawa Barat","-6.6032,106.8569","N"
"PT POS KPC RAWAMERTA","ADO042425","Jl Raya Sukamerta Rawamerta","Jawa Barat","-6.241941,107.361915","N"
"KOPERASI PAYU 285","AQ6161335","Dusun Karang Galuh Praya Timur","Nusa Tenggara Barat","-6.467567,106.66546","N"
"BRI TERAS TANJUNG PASIR","AQ6312706","Desa Tanjung Pasir","Banten","-6.06179,106.63214","N"
"PEGADAIAN UPC JATIUWUNG","ADO429516","Jl Jed Gatot Subroto No 6","Banten","-6.189122,106.592081","N"
"BANK SYARIAH INDONESIA KCP JATIUWUNG","AQ6381445","Jl Gatot Subroto Km 4 5","Banten","-6.188444,106.59214","N"
"BRI UNIT JATIUWUNG TANGERANG","AQ6270774","Jl Gatot Subroto Km 1","Banten","-6.18906,106.59127","N"
"PT POS KPC LEGOK","ADO080287","Jl M Soleh No 28 Pasar Legok","Banten","-6.296474,106.592004","N"
"PT POS KPC BOGOR SEMPLAK","ADO073874","Jl Raya Semplak","Jawa Barat","-6.561203,106.763327","N"
"PT POS KPC JATIUWUNG","ADO080067","Jl Perum Pondok Makmur","Banten","-6.184182,106.591144","N"
"MNC BANK KC BOGOR","ADO210330","Jl Raya Pajajaran No 41","Jawa Barat","-6.585607,106.805467","N"
"PEGADAIAN UPC GINTUNG KERTA","ADO470325","Jl Raya Klari No 10 Dusun Krajan","Jawa Barat","-6.354697,107.346267","N"
"BRI UNIT BATAKO TANGERANG","AQ6270729","Jl Prabu Kian Sintang No 1","Banten","-6.183104,106.590767","N"
"JNE BOGOR SUDIRMAN","ADO162347","Jl Jend. Sudirman No.58","Jawa Barat","-6.581591,106.796753","N"
"PEGADAIAN UPS TAMAN UBUD","ADO508365","Ruko Star Of Asia No 03 Taman Ubud Iii","Banten","-6.23319,106.585981","N"
"PT POS KPC BOGOR INSTITUT PERTANIAN BOGO","ADO073830","Jl Ry Pajajaran Ipb Baranangsiang","Jawa Barat","-6.58734,106.80599","N"
"PT MADAME EXPRESS REMITINDO KRW PEDES","AQ6250062","Jl Sungai Buntu Pedes Rt03 Rw05","Jawa Barat","-6.087492,107.335127","N"
"BRI UNIT ANGGADITA I KARAWANG","AQ6291256","Jl Raya Klari Kec Klari","Jawa Barat","-6.356705,107.34745","N"
"BRI TERAS PASAR LEGOK","AQ6311552","Jl Legok Karawaci Depan Psr Legok","Banten","-6.2984,106.58848","N"
"BANK SYARIAH INDONESIA KCP BOGOR","ADO516416","Jl Jendral Sudirman No 37 Kel Sempur","Jawa Barat","-6.58508,106.79668","N"
"PEGADAIAN UPC LEGOK","ADO429802","Jl Raya Parung Panjang No 98 Rt01 Rw01","Banten","-6.299081,106.587586","N"
"BRI UNIT KALIDERES JAKARTA","AQ6270477","Jl Peta Selatan Ruko Kalideres No 2c","Dki Jakarta","-6.23948,106.5826","N"
"PT POS KPC MAJALAYA","ADO171291","Jl Raya Syech Quro Km 10 Ciranggon","Jawa Barat","-6.291921,107.364917","N"
"PEGADAIAN UPS BANTAR KEMANG","ADO507386","Durian Raya No8","Jawa Barat","-6.5945,106.8128","N"
"BRI UNIT LEGOK","AQ6270082","Jl Raya Pr Panjang Km 1","Banten","-6.30128,106.58654","N"
"BRI TERAS PASAR REGENCY","AQ6312751","Jl Villa Tangerang Indah Blok Dc 3 No 3","Banten","-6.1704,106.58694","N"
"BANK BJB KCP JATIUWUNG","ADO205974","Jl Gatot Subroto Km 5.5 No. 8a","Banten","-6.196343,106.582424","N"
"BRI KCP SUDIRMAN BOGOR","AQ6233418","Jl Jend Sudirman 15d","Jawa Barat","-6.58903,106.79696","N"
"MAYBANK KCP PAJAJARAN","ADO000702","Komp Rukan Pajajaran Jl Pajajaran 20","Jawa Barat","-6.593396,106.804426","N"
"BANK SYARIAH INDONESIA KC PAJAJARAN","ADO511323","Jl Pajajaran No 8 Kel Baranangsiang","Jawa Barat","-6.59339,106.80414","N"
"PT POS KPC BOGOR UTARA","ADO073863","Komplek Indraprasta","Jawa Barat","-6.586446,106.787357","N"
"PEGADAIAN UPC KUTABUMI","ADO429725","Pertokoan Barkah Makmur No 88","Banten","-6.152875,106.587184","N"
"BANK BJB KCP CISAAT SUKABUMI","ADO201925","Jl Raya Caringin Cisaat","Jawa Barat","-6.629063,106.912173","N"
"BRI UNIT CURUG KULON","AQ6270213","Jl Raya Curug No 16 Curug","Banten","-6.31397,106.58406","N"
"JNE BEKASI KRANJI","ADO162392","Ruko Kranji Plaza, Jl. Jend. S","Jawa Barat","-6.59121,106.792878","N"
"PT POS KPC BOGOR BARAT","ADO073786","Jl Dr Sumeru Bogor Barat","Jawa Barat","-6.587381,106.784803","N"
"BRI SSB RES TANGERANG","AQ6290673","Tangerang","Banten","-6.176512,106.579993","N"
"BRI UNIT JATAKE","AQ6270279","Jl Gatot Subroto Km 5 5 Kel Keroncong","Banten","-6.19897,106.57682","N"
"BRI TERAS PASAR ANYAR","AQ6310748","Jl Raya Pasar Anyar","Jawa Barat","-6.592531,106.791866","N"
"PT POS KPC RUMPIN","ADO071641","Kp Pasar Gunung Nyuncung","Jawa Barat","-6.4559,106.6395","N"
"BRI UNIT PASAR MAWAR BOGOR","AQ6268179","Jl Raya Semeru No 23 Ruko No 1","Jawa Barat","-6.58975,106.78566","N"
"BRI UNIT PEJAGALAN JELAMBAR","AQ6271236","Jl Pejagalan Raya 12 A Rt 01 05 Pekojan","Dki Jakarta","-6.18861,106.57703","N"
"BRI UNIT DOYONG TANGERANG MERDEKA","AQ6270291","Jl Prabu Siliwangi Km 03 Rt 02 Rw 04","Banten","-6.18861,106.57703","N"
"BANK BJB KK BOTANI SQUARE","ADO205512","Jl Padjajaran Mall Botani Square","Jawa Barat","-6.601242,106.807043","N"
"BRI TERAS PASAR MERDEKA","AQ6310715","Jl Dr Semeru Pasar Merdeka Bogor","Jawa Barat","-6.59192,106.78727","N"
"PEGADAIAN UPC PERMATA PASAR KEMIS","ADO457050","Ruko Permata Tangerang Blok Ri No 25","Banten","-6.166729,106.57944","N"
"BANK SYARIAH INDONESIA KCP MERDEKA","ADO511356","Jl Merdeka No 63","Jawa Barat","-6.59254,106.78801","N"
"BRI KC BOGOR DEWI SARTIKA","AQ6230679","Jl Dewi Sartika No 6","Jawa Barat","-6.59487,106.79202","N"
"PT POS KPC TANGERANG JATAKE","ADO080089","Jl Gatot Subroto Km 7 5 No 14","Banten","-6.199665,106.574503","N"
"PT POS KPC BOGOR CIOMAS","ADO112067","Jl Raya Gunung Batu","Jawa Barat","-6.582724,106.769113","N"
"MAYBANK KCP DEWI SARTIKA","ADO002506","Jl. Dewi Sartika No 2d Bogor","Jawa Barat","-6.595521,106.791892","N"
"BANK SYARIAH INDONESIA KCP MERDEKA PGB","AQ6382006","Jl Perintis Kemerdekaan","Jawa Barat","-6.593175,106.7865","N"
"BANK BJB KC BOGOR","ADO201101","Jl Kapten Muslihat No 11 13","Jawa Barat","-6.595946,106.79171","N"
"PT POS LE TAMANTOPI","ADO174997","Jl Kapten Muslihat No 51 Kel Paledang","Jawa Barat","-6.596518,106.792632","N"
"BRI UNIT SINDANG BARANG BOGOR","AQ6292806","Jl Let Ibrahim Aji No 29","Jawa Barat","-6.57925,106.76083","N"
"BRI UNIT SINDANG BARANG BOGOR","AQ6267442","Jl Let Ibrahim Aji No 29","Jawa Barat","-6.57925,106.76083","N"
"BANK BJB KK WAROENG PASAR KEMIS","ADO206403","Jl Raya Kotabumi Pasarkemis Blok B No  6","Banten","-6.153801,106.578493","N"
"PT POS KPC KPC JEBUS","ADO073841","Jl Raya Jebus Jebus","Bangka Belitung","-6.60003,106.795067","N"
"PT POS MPS BOGOR 1","ADO178748","Jl Ir H Juanda No 5","Jawa Barat","-6.600057,106.795064","N"
"PT POS KPRK BOGOR","ADO041095","Jl Ir H Juanda No 5","Jawa Barat","-6.600055,106.795057","N"
"PT POS MPS BOGOR 5","ADO178759","Jl Ir H Juanda No 5","Jawa Barat","-6.600061,106.795067","N"
"PT POS LE PAMIJAHAN","ADO900437","Jl Raya Pamijahan","Jawa Barat","-6.591493,106.778186","N"
"BRI TERAS BANTARJAYA","AQ6310737","Jl Bantarjaya Kel Bantarjaya","Jawa Barat","-6.56194,106.73169","N"
"BRI KCP IPB DERMAGA","AQ6293753","Kampus Institut Pertanian Bogor Dermaga","Jawa Barat","-6.5622,106.73188","N"
"BRI KCP IPB","AQ6233441","Kampus Institut Pertanian Bogor Dermaga","Jawa Barat","-6.5622,106.73188","N"
"BANK BJB KCP IPB DARMAGA","ADO201156","Jl Raya Babakan 38","Jawa Barat","-6.562803,106.732543","N"
"PT POS KPC BOGOR DARMAGA","ADO071618","Jl Raya Dramaga Kampus Ipb","Jawa Barat","-6.563543,106.733063","N"
"BANK SYARIAH INDONESIA KCP CIBANTENG","AQ6382051","Jl Raya Cibanteng No 155","Jawa Barat","-6.558829,106.726578","N"
"BANK SYARIAH INDONESIA KCP CIBANTENG","AQ6383623","Jl Raya Cibanteng No 155","Jawa Barat","-6.558829,106.726578","N"
"PEGADAIAN UPC DRAMAGA","ADO454024","Jl Bugah Sari Ciputih","Jawa Barat","-6.572562,106.745357","N"
"PEGADAIAN CP BOGOR","ADO191321","Jl Ir Juanda No 02 Bogor Tengah","Jawa Barat","-6.603257,106.798459","N"
"MAYBANK KCP BARANANG SIANG","ADO008458","Jl Raya Pajajaran Ruko Pulo Armin N 78n","Jawa Barat","-6.608499,106.80974","N"
"BANK SYARIAH INDONESIA KCP DRAMAGA","ADO511367","Jl Perwira No 151 Dramaga","Jawa Barat","-6.56225,106.73047","N"
"BRI TERAS PASAR BOGOR","AQ6310638","Jl Raya Surya Kencana","Jawa Barat","-6.6037,106.79907","N"
"BRI UNIT PURBASARI","AQ6265637","Jl Raya Cibabat No 377","Jawa Barat","-6.59249,106.77663","N"
"BANK SYARIAH INDONESIA KCP DRAMAGA","AQ6381984","Jl Dramaga Kp Babakan Doneng Rt 02 Rw 06","Jawa Barat","-6.562213,106.729096","N"
"BRI KCP KPPN BOGOR","AQ6233627","Gedung Kppn Bogor Jl Ir H. Juanda No 62","Jawa Barat","-6.60293,106.79535","N"
"PEGADAIAN CP GUNUNG BATU","ADO192113","Jl Mayjen Ishak Djuarsa No 96","Jawa Barat","-6.593592,106.777292","N"
"PEGADAIAN UPC GEMBOR","ADO429374","Jl Raya Psr Kemis Km 4 Kp Gelam Jaya","Banten","-6.182826,106.570582","N"
"BRI TO KARYA BHAKTI","AQ6260126","Jl Raya Dramaga Km 7","Jawa Barat","-6.569506,106.738274","N"
"PT POS KPC TALAGASARI KARAWANG","ADO042447","Jl Raya Syeh Quro No 3","Jawa Barat","-6.288835,107.382433","N"
"PEGADAIAN UPC BOGOR TRADE MALL","ADO425732","Jl Ir Juanda No68 Lt Ground Blok A5 No1","Jawa Barat","-6.605287,106.797153","N"
"MAYBANK KC BOGOR","ADO000230","Jl Surya Kencana No 231","Jawa Barat","-6.608728,106.803032","N"
"BANK BJB KCP SURYA KENCANA","ADO205480","Jl Surya Kencana No 315","Jawa Barat","-6.609665,106.804437","N"
"BRI KCP BARANANGSIANG","AQ6233429","Jl Raya Pajajaran Jend Sudirman No 78 O","Jawa Barat","-6.61407,106.8134","N"
"PEGADAIAN UPC PASAR SUKASARI","ADO425798","Jl Siliwangin Atas No 1129 Rt00 Rw00","Dki Jakarta","-6.612077,106.808726","N"
"PT POS KPC SEPATAN","ADO080177","Jl Raya Sepatan Mauk Km 12 5","Banten","-6.123131,106.580837","N"
"BRI KCP SURYAKENCANA","AQ6233463","Jl Suryakencana No312 Sukasari","Jawa Barat","-6.61089,106.80528","N"
"BANK BJB KK EMPANG","ADO205491","Jl Pahlawan No 31 33","Jawa Barat","-6.607773,106.797563","N"
"PT POS LE KOSAMBI","ADO175800","Jl Raya Telagasari Kosambi","Jawa Barat","-6.301138,107.382897","N"
"BRI TERAS PASAR TELAGASARI","AQ6310935","Jl Syeh Quro Kec Telagasari","Jawa Barat","-6.28874,107.3852","N"
"PT POS KPC TANGERANG KOTABUMI","ADO080209","Jl Raya Kotabumi Ruko P Indah","Banten","-6.155141,106.571156","N"
"BRI TERAS PASAR DREMAGA CARINGIN","AQ6310726","Jl Raya Caringin Dramaga","Jawa Barat","-6.575443,106.739803","N"
"BRI TERAS PASAR KUTABUMI","AQ6312740","Taman Kutabumi Blok B16 No 17 Kutabumi","Banten","-6.155,106.57092","N"
