"name","orig_id","streetAddress","state","location","platinum"
"WU MULTICENTRO","APM037440","C C  Multicentro 1er  Piso A Lado De La","Panama","8.976956,-79.517862","Y"
"AM PM OBARRIO","APM038517","Calle Samuel Lewis Edif Generalli Local1","Panama","8.985543,-79.521677","N"
"AM PM BEIRUT","APM038627","Avenida Ricardo Arias Am Pm Penta Plaza","Panama","8.984647,-79.523592","N"
"WU PLAZA CONCORDIA","APM031400","Via Espana Plaza La Concordia Local 131","Panama","8.984679,-79.525998","Y"
"MAS ME DAN VENETO","APM036241","Frente Del Don Lee","Panama","8.983816,-79.52727","Y"
"MONKEY PRINT","APM038353","Marbella Cl Aquilino De La Guardia Edif","Panama","8.975689,-79.521452","N"
"EMPENOS VENETO 5","APM038463","Vista Hermosa Al Lado Del 99","Panama","8.983748,-79.526863","N"
"WU MULTIPLAZA","APM035471","Cc Multiplaza Tercer Piso","Panama","8.986601,-79.511186","Y"
"KENG FAIN LIANG","APM038452","Urb Bella Vista Call 4 Edif Ph Kitaen","Panama","8.986373,-79.526569","N"
"MAS ME DAN CL  50","APM038364","Calle 50 Plaza La Colmena Local 5","Chiriqui","8.986034,-79.512751","N"
"MAS ME DAN VIA PORRAS","APM036229","Diagonal Al Super 99 Despues D","Panama","8.99313,-79.517077","Y"
"CASA DE EMPENOS CASH CASH","APM038474","Via Argentina Calle Principal Ed","Panama","8.988518,-79.528724","N"
"AM PM VIA ISRAEL","APM038528","Via Israel Edif  The Plaza Local Pb","Panama","8.987498,-79.509191","N"
"AM PM VIA PORRAS","APM038539","Via Porras City Plaza Local 8","Panama","8.993952,-79.516368","N"
"EMPENOS VENETO","APM030553","Vista Hermosa Al Lado Del Super 99","Panama","8.997968,-79.519688","Y"
"MAS ME DAN TRANSISTMICA","APM036252","Frente Al Mcdonald","Panama","8.995784,-79.5281","Y"
"EMPENOS VENETO 4","APM038441","Bella Vista P H  Lemon Tower","Panama","8.97825,-79.531799","N"
"MAS ME DAN VISTA HERMOSA","APM036603","Frente Al Super 99","Panama","8.998656,-79.519927","Y"
"AM PM CANGREJO","APM038496","Cangrejo Via Argentin Ed Vellure Localpb","Panama","8.985797,-79.532708","N"
"WU XTRA TRANSISTMICA","APM037945","Transistmica Simon Boolivara E","Panama","8.990868,-79.503795","Y"
"EMPENOS VENETO 2","APM031411","Avenida Peru Hotel Venecia","Panama","8.972256,-79.535594","Y"
"CD XTRA VIA ISRAEL SOLUCIONES INTEGRALES","APM038320","Urb. San Francisco Cl","Panama","8.987235,-79.501831","N"
"WU MACHETAZO CALIDONIA","APM030102","Dentro De Le Machetazo De Cali","Panama","8.967577,-79.539196","Y"
"AM PM VIA ESPANA","APM038616","Via Espana Edif Alai Local Pb","Panama","9.001758,-79.516256","N"
"MAS ME DAN CALIDONIA","APM036537","Calle 21 De Enero Antiguea Hie","Panama","8.96511,-79.539622","Y"
"JOYERIA PERU","APM032807","Calidonia Edif Arbel Local 4 P","Panama","8.972118,-79.539233","N"
"MAS ME DAN DORADO 2","APM036593","Al Frente De La Casa Redonda","Panama","9.007379,-79.533657","Y"
"SUPER CASH 12 DE OCTUBRE","APM037846","Pueblo Nuevo Ave 12 De Octubre Calle","Panama","9.009032,-79.507892","Y"
"MAS ME DAN PLAZA 5 DE MAYO","APM036339","Peatonal Al Frente Del Banismo","Panama","8.960249,-79.541025","Y"
"WU EL DORADO","APM031147","Urbanizacion Betaniaedificio P H Centro","Panama","9.008513,-79.53592","Y"
"MAS ME DAN EL DORADO / BANCO NACIONAL","APM036438","Dorado Mall","Panama","9.009138,-79.535064","Y"
"EMPENOS VENETO 3","APM031488","Ave. Cuba Edif. Poli Local B3","Panama","8.965356,-79.538185","N"
"CD XTRA CALIDONIA  PRONTO GIROS","APM038397","Xtracalidonis Avseptima Central Y Avperu","Panama","8.966648,-79.540288","N"
"MAS ME DAN ALBROOK TERMINAL","APM036560","La Terminal A Lado De La Caja","Panama","8.975366,-79.551517","Y"
"WU TERMINAL","APM033941","Kiosco Kc-08 Frente Al Banco Azteca","Panama","8.974751,-79.551448","Y"
"MAS ME DAN CENTRAL  CL  17","APM036526","Frente Al Css Al Lado Del Hote","Panama","8.957086,-79.541228","Y"
"WU ALBROOK","APM030377","Albrook Mall Pasillo Del Elefante","Panama","8.974634,-79.552807","Y"
"WU MACHETAZO SANTA ANA","APM035790","Dentro Del Machetazo Santana","Panama","8.954917,-79.539829","Y"
"MAS ME DAN RIO ABAJO","APM036306","Calle 7 Rio Abajo Frente Al","Panama","9.013145,-79.50118","Y"
"WU  XTRA ALBROOK MAL","APM037462","Albrook Mall Pasilloo De La Or","Panama","8.968835,-79.554106","Y"
"PRONTO GIROS RIO ABAJO","APM037714","Rio Abajo Al Lado De La Pan Rio De Oro","Panama","9.014886,-79.49868","Y"
"MMD ALBROOK MALL","APM036571","Albrook Mall Entrada Del Elefante","Panama","8.974697,-79.552384","N"
"AM PM CASCO VIEJO","APM038506","Santa Ana Calle 8 Edificio La Moderna","Panama","8.953443,-79.537062","N"
"CD XTRA TUMBA MUERTO-PRONTO GIROS","APM037703","Ricardo J Alfaro, Plaza King´s Park","Panama","9.026214,-79.521612","Y"
"MAS ME DAN MONTE OSCURO","APM036362","Centro Comercial La Gran Estac","Panama","9.02744,-79.505775","Y"
"ZOOM SERVICE PANAMA S A","APM035206","Oficentro Del Este Av Centenario Panama","Panama","9.014658,-79.483991","Y"
"WU MACHETAZO SAN MIGUELITO","APM035844","Dentro Del El Machetazo","Panama","9.029134,-79.506947","Y"
"MAS ME DAN CHANIS","APM036515","Frente Al 99 De Chanis","Panama","9.018008,-79.484946","Y"
"MAS ME DAN SAN MIGUELITO","APM038012","Urbanizacion Monte Oscuro Cl","Panama","9.030403,-79.504126","Y"
"WU XTRA CHORRILLO","APM037682","El Chorrillo Calle Venida A Edificio Ph","Panama","8.949417,-79.545502","N"
"SUPER CASH TUMBA MUERTO","APM030355","Tumba Muerto Plaza Condado Del Rey","Panama","9.025828,-79.521934","N"
"EL PENON SAN MIGUELITO","APM033127","La Gran Estacion Al Lado De Su","Panama","9.026684,-79.506544","N"
"MAS ME DAN PLAZA CAROLINA","APM036328","Cerca De Rodelag Prox","Panama","9.028434,-79.47877","Y"
"WU XTRA SAN MIGUELITO","APM035569","San Miguelito Dentro Del Super","Panama","9.044737,-79.524977","Y"
"AM PM COSTA DEL ESTE","APM038485","Calle Cincuentenario Costa Del Este","Panama","9.016033,-79.481391","N"
"SUPER FARMACIA LOS ANGELES","APM036658","Angeles Bocas Del Toro Super Xtra De","Bocas Del Toro","9.009087,-79.475843","N"
"MAS ME DAN VILLA LUCRE","APM036218","Proximo A Pizza Hut","Panama","9.037657,-79.48115","Y"
"MMD LOS ANDES 1","APM036395","Centro Comercial Los Andes Mall","Panama","9.049391,-79.50813","Y"
"MAS ME DAN LOS ANDES 2  METRO","APM036384","Frente Al Elevador Del Merto D","Panama","9.049475,-79.508213","Y"
"WU ATRIO MALL","APM037769","Edif Atrio Mall 4to Piso Al Lado De Sub","Panama","9.022024,-79.46291","Y"
"CD XTRA VILLA LUCRE PRONTO GIROS","APM038210","Dentro Del Xtra De Villa Lucre","Panama","9.040118,-79.48087","Y"
"WU XTRA OJO DE AGUA","APM035525","Centro Comercial Villa Zaita","Panama","9.055917,-79.508921","Y"
"MAS ME DAN SAN ISIDRO","APM037781","San Miguelito San Isidro Cl Principal","Panama","9.064739,-79.510691","Y"
"EL PENON LOS ANDES","APM033105","Centro Comercial Los Andes","Panama","9.049773,-79.507726","N"
"MAS ME DAN LOS PUEBLOS","APM036373","Nivel 200 Kd 28","Panama","9.04484,-79.453495","Y"
"WU LOS PUEBLOS","APM030058","Centro Comercial Los Pueblos","Panama","9.046359,-79.453054","Y"
"EL PENON VILLA ZAITA","APM036812","Urbanizacion Villa Zaita Cl Trnstmica","Panama","9.074589,-79.524236","Y"
"WU XTRA LOS PUEBLOS","APM035536","Los Pueblos","Panama","9.044618,-79.45079","Y"
"WU MACHETAZO METROMALL","APM035833","Dentro Del El Machetazo","Panama","9.051552,-79.4514","Y"
"WU METROMALL","APM033819","Centro Comercial Metro Mall Lo","Panama","9.053336,-79.452065","Y"
"AM PM  EL CRISOL","APM038584","Juan Diaz El Crisol Edif City Plaza","Panama","9.043809,-79.470261","N"
"MONKEY PRINT VILLA ZAITA","APM038430","Plaza Villa Zaita Local 19 Diagonal","Panama","9.069405,-79.514101","N"
"EL PENON BRISAS DEL GOLF","APM035657","Super Centro Del Dorado","Panama","9.070174,-79.4531","Y"
"WU MACHETAZO COSTA SUR","APM035909","Dentro Del El Machetazo","Panama","9.036471,-79.41892","Y"
"MAS ME DAN EL PARADOR","APM037792","Juan Diaz Cruce De Av Jose Domingo Diaz","Panama","9.058804,-79.43241","Y"
"SUPER CASH CERRO V 1","APM030290","Entrada A Urb. Cerro Viento","Panama","9.050441,-79.45502","N"
"EL PENON LOS PUEBLOS","APM033149","Centro Comercial Los Pueblos","Panama","9.045858,-79.44936","N"
"MAS ME DAN LAS ACACIAS","APM036405","A Un Costado Del Xtra De Las A","Panama","9.059966,-79.42754","Y"
"WU XTRA LAS ACACIAS","APM035558","Dentro Del Super Xtra Las Acac","Panama","9.059909,-79.42746","Y"
"WU XTRA EL LAGO","APM036779","Urb. El Lago Corredor Norte","Panama","9.103346,-79.521423","Y"
"EL PENON METRO MALL","APM033150","Centro Comercial Metro Mall","Panama","9.051998,-79.45137","N"
"MAS ME DAN LA CABIMA","APM036427","Mall De La Cabima Al Lado Del","Panama","9.109491,-79.536477","Y"
"WU XTRA ARRAIJAN","APM035581","Entrada De Arraijan Local #1","Panama Oeste","8.956072,-79.652701","Y"
"MAS ME DAN ARRAIJAN XTRA","APM036559","Centro Comercial Super Extra","Panama Oeste","8.956656,-79.653596","Y"
"MAS ME DAN PEDREGAL","APM036351","Proximo A Antiguo Banco Trasat","Panama","9.056252,-79.43328","N"
"MAS ME DAN PLAZA LAS MANANITAS","APM036878","Plaza Las Mananitas Local","Panama","9.080304,-79.404304","Y"
"MULTICASH MANANITAS","APM035482","Ciudad Vacamonte Centro Comerc","Panama","9.079733,-79.403658","Y"
"MULTICASH PLAZA TOCUMEN","APM035493","Plaza Tocumen","Panama","9.061855,-79.4224","N"
"MAS ME DAN NUEVO CHORRILLO","APM038056","Arraijan Cerro Silvestre Cl","Panama Oeste","8.946195,-79.680397","Y"
"WU MACHETAZO TOCUMEN","APM035855","Dentro Del El Machetazo","Panama","9.099281,-79.38906","Y"
"JUMBO MARKET LAS MANANITAS","APM038111","Las Mananitas Frente Al La Urbanizacion","Panama","9.077033,-79.411164","N"
"SUPER CASH TEC VACAMONTE","APM030498","Via Argentina Edif Arcadia L-2","Panama Oeste","8.921551,-79.696709","Y"
"CD XTRA VISTA ALEGRE VPRONTO GIROS","APM038209","Dentro Del Xtra Vista Alegre","Panama Oeste","8.931849,-79.70163","Y"
"MAS ME DAN PLAZA LAS MANANITAS","APM038254","Mananitas Cl Interamericana Edificio","Panama","9.080252,-79.404068","N"
"MAS ME DAN 24 DE DICIEMBRE","APM036582","Centro Comercial La Dona","Panama","9.104446,-79.370126","Y"
"WU WESTLAND","APM034029","Via Panamericana Ph Nuevo Tocumen","Panama Oeste","8.922962,-79.704448","Y"
"CD XTRA 24 DICIEMBRE PRONTO GI","APM037725","Cl Principal 24 Diciembre Dent","Panama","9.103604,-79.366788","Y"
"ZONA LIBRE MALL","APM037550","Zona Libre Chilibre  Cl San Vicente","Panama","9.122616,-79.594252","N"
"MAS ME DAN VISTA ALEGRE","APM036207","Proximo Al Super El Rey","Panama Oeste","8.925962,-79.71191","Y"
"MAS ME DAN PLAZA NUEVO TOCUMEN","APM036636","Plaza Mayorca San Miguelito","Panama","9.101194,-79.355671","Y"
"SUPER EXPRESS BAY MALL","APM038089","Avenida Balboa Bay Mall","Panama","8.946195,-79.680397","N"
"FABYS BOUTIQUE","APM038429","Arraijan Cerro Silvestre","Panama Oeste","8.936604,-79.684718","N"
"SUPER CASH TOCUMEN","APM035646","Villa Loching","Panama","9.078972,-79.367455","N"
"SUPER CASH PLAZA LA MARQUEZA","APM038418","Urb  La Loceria Plaza La Marqueza","Panama Oeste","8.971573,-79.705055","N"
"WU MACHETAZO ARRAIJAN","APM035822","Dentro Del El Machetazo","Panama Oeste","8.915634,-79.742824","Y"
"El PENON LA DONA","APM033138","Centro Comercial La Dona","Panama","9.103556,-79.36883","N"
"SUPER CASH VISTA ALEGRE","APM034063","Edificio Plaza Fortuna","Panama Oeste","8.925519,-79.710663","N"
"SUPER CASH PLAZA NUEVO TOCUMEN","APM037956","Ph Plaza Nuevo Tocumen Local 10","Panama","9.101243,-79.355673","N"
"SUPER CASH ARRAIJAN","APM038221","Urb Nuevo Arraijan Comercial Central Pl","Panama Oeste","8.926844,-79.718696","N"
"WU XTRA LAS ANCLAS","APM036856","Chorrera Barrio Colon","Panama Oeste","8.892862,-79.76351","Y"
"WU XTRA PACORA","APM036900","Pacora Carretera Panamericana","Panama","9.098954,-79.284736","Y"
"MAS ME DAN LA CHORRERA  1  ELEKTRA","APM036416","Centro Comercia Westland Mall","Panama Oeste","8.888396,-79.770916","Y"
"MAS ME DAN CHORRERA CENTRO","APM036494","Antigua Calle El Puerto","Panama Oeste","8.878908,-79.782113","Y"
"MAXI TRANSFERENCIA","APM038375","Urb  Cabra Centro Comercial Pl","Panama","9.113932,-79.335449","N"
"MINI SUPER LA ROSA ROJA","APM038595","Buenos Aire Chilibre Calle Madden","Panama","9.200681,-79.607771","N"
"CD XTRA LA CHORRERA PRONTO GIROS","APM038199","Dentro Del Xtra Chorrera","Panama Oeste","8.870719,-79.800564","Y"
"SUPER CASH ROMANA 8","APM030629","Frente A Plaza Italia","Panama Oeste","8.889124,-79.771072","N"
"SUPER CASH VISTA MAR","APM037868","Puerto Caimitto Cl Principal Centro","Panama Oeste","8.866561,-79.765145","N"
"SUPERMERCADO EL PUEBLO 2","APM035679","Chorrera","Panama Oeste","8.885135,-79.775305","N"
"SUPER CASH CHORRERA","APM034030","Barrio Colon","Panama Oeste","8.881268,-79.779934","N"
"SUPERMERCADO EL PUEBLO 1","APM035680","Chorrera","Panama Oeste","8.879118,-79.780546","N"
"EL SUPER AHORRO","APM038078","Buenas Vista Colon  Carretera","Colon","9.271717,-79.692291","N"
"MAS ME DAN COLON CL 13","APM036757","Barrio Sur La Cresta Calle13","Colon","9.358823,-79.899661","Y"
"EMPENOS BOA","APM038551","Calle 10 Amador Guerrero Casa 10156","Colon","9.356305,-79.902347","N"
"WU COLON","APM030245","Calle 13 Y Avenida Central","Colon","9.353952,-79.900814","Y"
"MAIL BOXES ZONA LIBRE","APM036823","Colon Plaza Millenium Local F007","Colon","9.345546,-79.892748","N"
"MAS ME DAN COLON 4 ALTO","APM036472","Centro Comercial 4 Altos","Colon","9.338641,-79.883832","Y"
"LABORATORIO BIOCLINICO POPULAR","APM038540","Urbanización Sabanita  Edificio Plaza","Colon","9.335257,-79.881926","N"
"CD XTRA CATIVA PRONTO GIROS","APM037989","San Judas Tadeo Cl Principal Y Carretera","Colon","9.358036,-79.841808","N"
"CASA DE EMPENOS PRESTEZA","APM034591","Edificio The Winners Plaza Lacal #3","Colon","9.348074,-79.80625","Y"
"MAS ME DAN COLON SABANITAS","APM036461","Al Lado Del Super Mercado Rey","Colon","9.347625,-79.806863","N"
"PRONTO GIROS COLON","APM037693","Urb Barrio S C 10 Y Av Bolivar Edif10","Colon","9.354486,-79.802872","N"
"WU XTRA DAVID","APM036834","Sve. Tomas Armuelle A Un  Cost","Chiriqui","8.428854,-82.444395","Y"
"MAS ME DAN SAN MATEO 2","APM037934","David Urbanizacion San Mateo Cl F Sur","Chiriqui","8.428782,-82.438403","Y"
"EMPENOS THORP  DAVID","APM038331","Urb  Calle 3 Ave  Segunda Este David","Chiriqui","8.427502,-82.443228","N"
"MAS ME DAN DAVID","APM038034","David Calle 3 Era Edificio Lemiol Local","Panama","8.433651,-82.423411","Y"
"JOY Y EMPENOS LA PERLA 2","APM031509","Ave 1ra Y 2da Cl Norte Edif Do","Chiriqui","8.427064,-82.425111","N"
"JOY Y EMPENOS LA PERLA 1","APM031510","Calle A Norte Entre Ave 4ta Y","Chiriqui","8.430318,-82.426349","N"
"MAS ME DAN BUGABA","APM036548","Ave Central Calle Central","Chiriqui","8.517871,-82.619779","Y"
"RAPID FOODS","APM038133","Chiriqui Distrito De Dolega Cgto Dolega","Chiriqui","8.569471,-82.418075","N"
"EMPENOS THORP  BUGABA","APM038342","Urb  Concepcion Cl Principal Bugaba","Chiriqui","8.51667,-82.6167","N"
"CASA DE EMPENOS MONEY CASH","APM032094","Paso Canoas, Chiriqui","Chiriqui","8.533644,-82.838409","Y"
"ALEME","APM033183","Brisas Del Golf","Chiriqui","8.778492,-82.432361","N"
"FARMA EXPRESS PASO CANOA","APM038298","Edificio Don Samy Paso Canoa","Chiriqui","8.531683,-82.837767","N"
"CASA EMPENO AMETH","APM038265","Volcan Cerro Punta","Chiriqui","8.781775,-82.638561","N"
"FARMA EXPRESS PUERTO ARMUELLES","APM035691","Puerto Armuelle","Chiriqui","8.271932,-82.859177","N"
"WU MACHETAZO CORONADO","APM035877","Dentro Del El Machetazo","Panama Oeste","8.544383,-79.914225","Y"
"MAS ME DAN CORONADO","APM036450","Centro Comercial De Village","Panama Oeste","8.543971,-79.914252","Y"
"CENTRO COMERCIAL EL VALLE ANTON","APM033666","El Valle Cl. Principal","Cocle","8.600429,-80.119749","N"
"MAS ME DAN SANTIAGO","APM036263","Ave  Central Depues De Optica","Veraguas","8.097781,-80.977593","Y"
"COOPERATIVA JUAN XIII","APM035745","Av Central Frente A La Placita","Veraguas","8.09724,-80.981854","N"
"AGRO FERRETERIA JUAN XIII","APM035789","Ave  Central Calle 4ta","Veraguas","8.097111,-80.982109","N"
"COOPERATIVA JUAN XIII AHORRO Y","APM036010","Aev. Central Santiago","Veraguas","8.097214,-80.982361","N"
"SERVICIOS MARTINEZ SANTIAGO","APM030047","Diagonal A La Escuela Normal D","Veraguas","8.100699,-80.978354","N"
"WU MACHETAZO SANTIAGO","APM035899","Dentro Del El Machetazo","Veraguas","8.102152,-80.966157","Y"
"WU XTRA SANTIAGO TERMINAL","APM038045","Santiago Al Lado De La  Termin","Veraguas","8.104116,-80.974792","N"
"COOPERATIVA JUAN XIII CANTO DE","APM036032","Rl Sucursal De Ahorro Y Credito","Veraguas","8.114321,-80.968884","N"
"SUPER MERCADO MANA","APM038308","Santiago Urbanizacion San Antonio Calle","Veraguas","8.08489,-80.932715","N"
"WONGMARKET","APM038638","Calle Avenida Fundadores Y Ave A Oeste","Santiago","8.088426,-81.057768","N"
"JOYERIA Y EMPENOS ANITA","APM032061","Ave Norte Ocu, Al Lado De Bibl","Herrera","7.945574,-80.776718","N"
"COOPERATIVA JUAN XXIII SONA","APM035976","Sona Veraguas","Veraguas","8.008449,-81.319025","N"
"ERFRAS","APM038232","Pese Barriada San Martin","Herrera","7.908671,-80.61519","N"
"CD XTRA AGUADULCE A AND J SERVICES","APM038177","Dentro Del Super Xtra De Aguadulce","Cocle","8.244534,-80.567301","N"
"FARMACIA DONA ENILDA","APM034810","Dentro Del Supermercado Multi Ahorro","Veraguas","7.647593,-80.989127","N"